name,cuisines,area,averagecost,dinner ratings,cluster
Sri Udupi Park,"South Indian, North Indian, Chinese, Street Food, Biryani, Ice Cream, Beverages, Shake","Indiranagar, Bangalore",450,4.0,4
Meghana Foods,"Biryani, Andhra, North Indian, Seafood","Indiranagar, Bangalore",700,4.3,4
Donne Biriyani House,Biryani,"Indiranagar, Bangalore",300,3.9,4
Domino's Pizza,"Pizza, Fast Food, Desserts","Indiranagar, Bangalore",400,2.4,2
KFC,"Burger, Fast Food, Biryani, Desserts, Beverages","Indiranagar, Bangalore",400,2.8,2
The Congee Concept,South Indian,"Ulsoor, Bangalore",100,,3
Burger King,"Burger, Fast Food, Beverages, Desserts","Indiranagar, Bangalore",400,4.1,4
McDonald's,"Burger, Beverages, Fast Food, Desserts","Indiranagar, Bangalore",400,3.8,4
Mani's Dum Biryani,"Biryani, Kebab","Jeevan Bhima Nagar, Bangalore",800,4.2,4
Madras Meal Company,South Indian,"Thippasandra, Bangalore",150,,3
ZAZA 22 Spice Biryani,"Biryani, Mughlai, North Indian","Indiranagar, Bangalore",200,,3
New Alameen Restaurant,"Kerala, North Indian, Chinese","Ulsoor, Bangalore",300,3.7,0
Ovenstory Pizza,"Pizza, Desserts","Indiranagar, Bangalore",250,,3
Biryani Trip,"Hyderabadi, Biryani","Indiranagar, Bangalore",250,,3
FreshMenu,"Continental, North Indian, Biryani","Indiranagar, Bangalore",200,,3
BOX8 - Desi Meals,"North Indian, Wraps, Fast Food, Biryani, Desserts, Beverages","Indiranagar, Bangalore",200,,0
Nagarjuna,"Andhra, Biryani, North Indian","Indiranagar, Bangalore",800,4.3,4
Natural Ice Cream,"Ice Cream, Beverages","Indiranagar, Bangalore",300,4.8,4
Bucket Biryani,"Biryani, Kebab","Brigade Road, Bangalore",1000,3.1,2
Rotti Walla,"North Indian, South Indian, Chinese, Mughlai, Biryani, Fast Food, Beverages, Desserts","Indiranagar, Bangalore",100,,3
Green Pepper,"Kerala, Biryani, North Indian, South Indian, Seafood, Chinese","Jeevan Bhima Nagar, Bangalore",600,4.0,4
Punjabi Dhaba,"North Indian, Mughlai, Chinese","Indiranagar, Bangalore",500,3.8,4
Burma Burma,"Salad, Burmese, Asian, Tea, Beverages","Indiranagar, Bangalore",1500,4.9,1
Pizza Hut,"Pizza, Fast Food, Desserts, Beverages","Indiranagar, Bangalore",400,3.8,4
Leon Grill,"Burger, Fast Food, Wraps, Street Food, Desserts, Beverages","Indiranagar, Bangalore",400,4.2,4
Onesta,"Pizza, Pasta, Fast Food, Desserts, Beverages, Sandwich, North Indian","Indiranagar, Bangalore",500,4.4,4
Paakashala,"South Indian, North Indian, Chinese, Juices, Beverages, Shake","Indiranagar, Bangalore",400,4.0,4
M.M.A Kabab and Rolls,"North Indian, Mughlai, Chinese, Kebab, Rolls, Seafood, Arabian, Biryani","Old Madras Road, Bangalore",500,2.7,2
Ayodhya Vihar Pure Veg,"North Indian, Chinese, South Indian, Beverages, Desserts, Juices, Ice Cream, Shake","Jeevan Bhima Nagar, Bangalore",450,3.4,2
Red Kitchen,"North Indian, Andhra, Chinese, Seafood, Mughlai, Biryani","Jeevan Bhima Nagar, Bangalore",350,3.1,2
Nandhana Palace,"Biryani, Andhra, North Indian, Chinese, Mughlai, South Indian, Desserts, Beverages","Indiranagar, Bangalore",800,4.3,4
A2B - Adyar Ananda Bhavan,"South Indian, Fast Food, Street Food, Ice Cream, Beverages, North Indian, Chinese","Indiranagar, Bangalore",800,2.8,2
Andhra Gunpowder,"Biryani, South Indian, Desserts, Beverages","Jeevan Bhima Nagar, Bangalore",200,,3
Nandhini Deluxe,"Andhra, Biryani, Chinese, North Indian, Mughlai, Desserts, Beverages","Frazer Town, Bangalore",700,3.8,4
Kanti Sweets,"Mithai, Street Food, Desserts","Thippasandra, Bangalore",50,,0
Dindigul Thalappakatti,"Biryani, North Indian, South Indian, Chinese, Beverages","Indiranagar, Bangalore",400,4.2,4
Five Star Chicken,"Wraps, Burger, Rolls, Fast Food, Street Food","KR Puram, Bangalore",100,,0
Kritunga Restaurant,"Andhra, Biryani, North Indian","Marathahalli, Bangalore",800,4.0,4
Donne Biriyani House,"Biryani, Fast Food","Shanti Nagar, Bangalore",400,3.4,2
Kabab Magic,"North Indian, Kebab, Hyderabadi, Beverages","Richmond Road, Bangalore",400,3.8,4
Polar Bear,"Ice Cream, Beverages, Shake","Thippasandra, Bangalore",350,3.7,0
Biriyani Zone,"Biryani, North Indian, Chinese, Mughlai, Kebab, Seafood, Ice Cream, Beverages","CV Raman Nagar, Bangalore",800,3.6,4
Paradise Biryani,"Biryani, North Indian, Kebab","HSR, Bangalore",700,3.7,4
Hyderabad Biryaani House,"Biryani, North Indian, Hyderabadi, Mughlai, Chinese","Old Airport Road, Bangalore",500,4.2,4
Anand Sweets And Savouries,"Mithai, Street Food, Desserts, Beverages","Old Airport Road, Bangalore",300,4.0,4
Subway,"Healthy Food, Fast Food, Sandwich, Salad, Beverages, Wraps","Indiranagar, Bangalore",400,2.0,2
Sri Udupi Food Hub,"South Indian, North Indian, Chinese, Street Food, Ice Cream, Desserts, Shake, Beverages","Domlur, Bangalore",800,3.7,4
Corner House Ice Creams,"Desserts, Ice Cream, Beverages","Indiranagar, Bangalore",300,4.8,4
Behrouz Biryani,"Biryani, Mughlai","Indiranagar, Bangalore",350,,3
MOJO Pizza - 2X Toppings,"Pizza, Fast Food, Desserts, Beverages","Indiranagar, Bangalore",250,,0
EatFit,"Mithai, North Indian, Pizza, Burger, Fast Food, Street Food, Desserts, Beverages","Indiranagar, Bangalore",200,,3
Amma's Pastries,Bakery,"Indiranagar, Bangalore",100,,0
Sharief Bhai,"Mughlai, Arabian, Afghan, Biryani, Kebab, Street Food, Beverages","Indiranagar, Bangalore",800,3.9,4
Beijing Bites,"Chinese, Thai, Seafood, Healthy Food","Indiranagar, Bangalore",800,3.2,2
Imperial Restaurant,"Mughlai, North Indian, Biryani, Chinese, Seafood, Ice Cream, Desserts, Beverages","Indiranagar, Bangalore",700,3.8,4
WOW! Momo,"Momos, Fast Food, Tibetan","Indiranagar, Bangalore",200,,0
Al Daaz,"North Indian, Continental, BBQ, Fast Food, Beverages","HSR, Bangalore",800,4.2,4
New Udupi Grand,"South Indian, North Indian, Chinese, Street Food, Beverages, Shake","Jeevan Bhima Nagar, Bangalore",300,2.9,2
Anjappar,"Chettinad, Biryani, Chinese, Seafood, South Indian, Mughlai, North Indian, Desserts","Indiranagar, Bangalore",800,3.9,4
Barbeque Nation,"BBQ, Mughlai, Biryani, North Indian, Desserts, Beverages","Indiranagar, Bangalore",1600,4.6,1
Faasos - Wraps & Rolls,"North Indian, Desserts, Wraps, Beverages","Indiranagar, Bangalore",200,,3
Kwality Wall’s Frozen Dessert and Ice Cream Shop,Ice Cream,"Indiranagar, Bangalore",100,,3
CakeZone,"Bakery, Desserts","Domlur, Bangalore",300,,0
Hari Super Sandwich,"Fast Food, Sandwich, Street Food","Brigade Road, Bangalore",200,3.2,2
Kapoor's Cafe,"North Indian, Beverages, Desserts","Kalyan Nagar, Bangalore",700,4.2,4
Sardarji Londonwaley,"North Indian, Chinese","Thippasandra, Bangalore",150,,3
La Pino'z Pizza,"Pizza, Fast Food","Indiranagar, Bangalore",500,3.7,4
Potful - Claypot Biryanis,"Biryani, Kebab, Mughlai, North Indian, Desserts, Beverages","Thippasandra, Bangalore",300,,0
Lassi Shop,"Fast Food, Ice Cream, Desserts, Shake, Beverages","Jeevan Bhima Nagar, Bangalore",100,,0
California Burrito,"Mexican, Fast Food, Beverages, Desserts","Indiranagar, Bangalore",500,4.1,4
Paratha Envy,North Indian,"Thippasandra, Bangalore",150,,3
Glen's Bakehouse,"Bakery, Italian, Pizza, Sandwich, Street Food, Desserts, Beverages","Indiranagar, Bangalore",400,4.2,4
Donne Biriyani House,"Biryani, South Indian","Kammanahalli, Bangalore",150,,0
NIC - Natural Ice Creams,Ice Cream,"Indiranagar, Bangalore",100,,3
Royal Restaurant,"North Indian, Chinese","Shivajinagar, Bangalore",200,4.0,4
New Krishna Sagar,"South Indian, North Indian, Chinese, Beverages","Indiranagar, Bangalore",350,3.5,0
Ambur Star Briyani Since 1890,"Biryani, Andhra, Chinese, Beverages","Indiranagar, Bangalore",700,3.2,2
Call Me Chow,"Chinese, Japanese, Thai, Indonesian, Asian","Kalyan Nagar, Bangalore",200,,0
Andhra Biryanis,"Biryani, Andhra, Chinese, North Indian","Indiranagar, Bangalore",250,,3
Falahaar & Kota Kachori,"North Indian, Rajasthani, Fast Food, Street Food, Mithai, Beverages","Indiranagar, Bangalore",100,,3
Ludos Pizza,"Pizza, Desserts","Indiranagar, Bangalore",200,,3
WarmOven Cake & Desserts,"Bakery, Desserts","Indiranagar, Bangalore",350,,3
LunchBox - Meals and Thalis,"North Indian, Healthy Food, Beverages, Chinese","Indiranagar, Bangalore",200,,3
Goli Vada Pav,"Street Food, Fast Food, Burger, Ice Cream, Desserts","Thippasandra, Bangalore",350,3.1,2
Meat And Eat,"Burger, Fast Food, Desserts, Beverages, BBQ, Sandwich, Finger Food","Domlur, Bangalore",400,3.3,2
Adiga's,"South Indian, North Indian, Chinese, Street Food, Desserts, Ice Cream, Beverages","Indiranagar, Bangalore",800,2.8,2
Rahhams,"Biryani, Mughlai, North Indian, Kebab, Chinese, Seafood, Rolls, Beverages","Old Airport Road, Bangalore",700,2.4,2
Great Indian Khichdi,"Healthy Food, Beverages","Indiranagar, Bangalore",150,,3
Ambur Biryani Point,"Biryani, Fast Food","Koramangala 1st Block, Bangalore",200,3.3,2
The Punjabi Rasoi,"North Indian, Chinese, Mughlai","Brookefield, Bangalore",150,,3
Smoor,"Desserts, Cafe, Pizza, Asian, Thai, Italian, Beverages, Shake","Indiranagar, Bangalore",900,4.6,1
Krispy Kreme,"Desserts, Beverages","Indiranagar, Bangalore",400,3.9,4
Savoury Express,"Mughlai, North Indian, Fast Food, Chinese, Desserts, Beverages, Shake","Jeevan Bhima Nagar, Bangalore",800,2.9,2
Pathaan Sir,"Fast Food, Momos, Rolls, Kebab, Juices","Indiranagar, Bangalore",300,2.8,2
Biryani By Kilo,"Biryani, Mughlai, Kebab, Hyderabadi","Koramangala 6th Block, Bangalore",700,4.0,4
Thalaivars Biryani,"Biryani, South Indian","Indiranagar, Bangalore",250,,3
Big Bowl Company,"North Indian, Chinese, Biryani, Fast Food, Momos","Indiranagar, Bangalore",200,,3
Shanthi Sagar,"South Indian, North Indian, Chinese, Beverages, Desserts, Shake","Ulsoor, Bangalore",250,3.8,0
New Udupi Garden,"South Indian, North Indian, Beverages, Chinese","Old Airport Road, Bangalore",350,3.5,0
Cakewala,"Bakery, Desserts","HSR, Bangalore",100,,0
Baskin Robbins,"Ice Cream, Desserts, Beverages","Indiranagar, Bangalore",400,,3
Chulha Chauki Da Dhaba,"North Indian, Biryani, Chinese, Beverages","Marathahalli, Bangalore",1000,4.5,1
Asha Sweet Center,"Mithai, Street Food","Indiranagar, Bangalore",400,2.3,2
Chai Point,"Tea, North Indian, Fast Food, Street Food, Beverages","Indiranagar, Bangalore",400,2.4,2
Yumlane Pizza,"Pizza, Fast Food, Desserts, Beverages","Indiranagar, Bangalore",250,,3
Mad Over Donuts,"Desserts, Beverages","Indiranagar, Bangalore",100,,0
Bakingo,"Bakery, Desserts","Thippasandra, Bangalore",350,,3
Sattvam,"North Indian, South Indian","Whitefield, Bangalore",1500,4.3,1
Starbucks Coffee,"Coffee, Desserts, Beverages","Indiranagar, Bangalore",600,4.3,4
Madurai Idly Shop,"South Indian, Chinese","Indiranagar, Bangalore",300,3.7,0
Aligarh House,"Biryani, North Indian, Kebab, Desserts, Beverages","Indiranagar, Bangalore",250,,0
Samosa Party,"Fast Food, Beverages, Burger, Tea","Jeevan Bhima Nagar, Bangalore",200,4.1,4
Delicacy,"Chinese, Thai","Frazer Town, Bangalore",500,3.8,4
Rolls On Wheels,"Rolls, Chinese, North Indian","Indiranagar, Bangalore",300,3.0,2
Laddoos,"Mithai, North Indian, Beverages, Fast Food, Street Food, Desserts","Jeevan Bhima Nagar, Bangalore",300,2.9,2
Chinese Wok - Wok Express,"Momos, Chinese","Indiranagar, Bangalore",200,,3
The Biryani Life,"Fast Food, North Indian, Desserts, Beverages","Indiranagar, Bangalore",250,,3
Peetuk,"Bengali, Biryani, Rolls","Domlur, Bangalore",200,,0
Ghee And Turmeric,"North Indian, Mughlai","Indiranagar, Bangalore",350,,3
The Hangout,"Pizza, Burger, Fast Food, Sandwich, Rolls","MG Road, Bangalore",300,3.0,2
Magnolia Bakery,"Bakery, Desserts","Indiranagar, Bangalore",300,4.2,4
RS Shiv Sagar,"North Indian, South Indian, Asian, Continental, Chinese, Desserts","MG Road, Bangalore",500,4.1,4
IDC Kitchen ,South Indian,"Indiranagar, Bangalore",200,3.5,0
Itminaan Biryani - Dum Pukht,"Biryani, Mughlai, North Indian","Indiranagar, Bangalore",250,,3
Dum Biryani Adda,"Biryani, North Indian","Jeevan Bhima Nagar, Bangalore",200,,3
Chowman,"Chinese, Asian, Thai, Oriental","Indiranagar, Bangalore",800,4.1,4
Just Shawarma,"Lebanese, Fast Food, Beverages","Indiranagar, Bangalore",100,,0
Udupi Krishna Grand,"South Indian, North Indian, Street Food, Biryani, Beverages, Chinese, Shake","Kalyan Nagar, Bangalore",500,3.4,2
Orbis Restaurant,"Mughlai, Biryani, North Indian, Arabian, Chinese, Beverages, Desserts","Indiranagar, Bangalore",750,3.7,4
Sri Udupi Grand,"South Indian, North Indian, Chinese, Beverages, Shake","Brigade Road, Bangalore",300,3.7,0
Empire Juices And Ice Creams,"Shake, Ice Cream, Desserts, Beverages","Indiranagar, Bangalore",100,,3
Ambur Dum Biriyani,"Biryani, Kebab","Indiranagar, Bangalore",200,3.1,2
Donne Biriyani Mane,"Biryani, South Indian, Chinese, North Indian","CV Raman Nagar, Bangalore",400,3.0,2
The Good Bowl,"North Indian, Mughlai","Indiranagar, Bangalore",200,,0
UBQ By Barbeque Nation,"North Indian, Kebab, BBQ, Biryani","Indiranagar, Bangalore",250,,3
ibaco,Desserts,"Indiranagar, Bangalore",250,4.1,4
NH1 Bowls - Highway To North,"North Indian, Kebab, Desserts","Indiranagar, Bangalore",200,,3
Sangam Sweets,"Mithai, Street Food, Fast Food","Koramangala 3rd Block, Bangalore",250,3.5,0
Snack House,"Street Food, Momos","Thippasandra, Bangalore",150,,0
Juice Junction,"Juices, Beverages, Sandwich, Fast Food, Shake, Rolls, Healthy Food, Street Food","St. Marks Road, Bangalore",250,3.9,0
Keventers - Milkshakes & Desserts,"Beverages, Desserts, Ice Cream, Shake","Garuda Mall, Magrath Road, Bangalore",200,3.3,2
Sangam Mess,"South Indian, Biryani, North Indian, Chinese, Seafood, Beverages","Kammanahalli, Bangalore",300,4.2,4
Roti Ghar Ki,North Indian,"CV Raman Nagar, Bangalore",100,,3
Shahi Family Restaurant,"North Indian, Chinese, South Indian, Biryani","Ulsoor, Bangalore",450,3.7,4
"Frozen Bottle - Milkshakes, Desserts and Ice Cream","Beverages, Desserts, Ice Cream, Waffle, Bakery, Healthy Food","Indiranagar, Bangalore",200,,0
AB's - Absolute Barbecues,"North Indian, Mangalorean, BBQ, Street Food, Desserts, Salad, Beverages","Marathahalli, Bangalore",1200,4.7,1
Odia Dine,"North Indian, Odia","Old Airport Road, Bangalore",300,3.9,4
Motis Kitchen,"South Indian, Kerala, Chinese, Seafood, Chettinad, North Indian","Thippasandra, Bangalore",350,4.2,4
Bullet Biryani,"Biryani, Fast Food","Indiranagar, Bangalore",150,,3
New Tandoor,"North Indian, Chinese, Mughlai, Rolls, Biryani, Seafood","CV Raman Nagar, Bangalore",600,3.6,4
Taj Hotel,"Mughlai, Chinese, South Indian, North Indian","Shivajinagar, Bangalore",500,3.5,0
New Punjabi Hotel,"North Indian, Chinese","Indiranagar, Bangalore",400,3.6,0
Cupcake Bliss Cakes & Desserts,"Bakery, Desserts","Indiranagar, Bangalore",300,,0
Kailash Parbat,"Chinese, North Indian, Street Food, Fast Food, Desserts, Beverages","Indiranagar, Bangalore",1100,3.3,2
EasyBites by Empire,"Burger, Fast Food, Beverages","Brigade Road, Bangalore",100,,0
Kaati Zone Rolls And Wraps,"Rolls, Sandwich","Indiranagar, Bangalore",150,,3
7 Plates,"North Indian, Mughlai, Rolls, Chinese","Frazer Town, Bangalore",200,,0
Hotel Navayuga,"Andhra, Biryani","Majestic, Bangalore",300,4.2,4
Siddique Kabab Centre,"Mughlai, Chinese, North Indian, Rolls","Frazer Town, Bangalore",400,4.0,4
Auntie Fung's,"Asian, Thai, Vietnamese, Japanese, Indonesian, Chinese, Korean, Burmese","Indiranagar, Bangalore",300,,3
Moriz Nano Restaurant,"North Indian, Chinese, Arabian, Mughlai, Fast Food, Beverages, Shake","Ulsoor, Bangalore",700,3.2,2
Biryani Day,"North Indian, Chinese, Biryani","Marathahalli, Bangalore",700,3.9,4
Five Star Chicken & Koli Hut,"Fast Food, Kebab, Chettinad","CV Raman Nagar, Bangalore",300,3.5,0
Just Bake,"Bakery, Desserts, Fast Food","Marathahalli, Bangalore",350,3.0,2
Zaatar,"BBQ, Arabian, Salad, Chinese, North Indian, Mughlai, Desserts, Beverages","Old Madras Road, Bangalore",1000,4.1,4
Malabar Hotel,"Kerala, Chinese, North Indian","Kaggadasapura, Bangalore",350,3.8,0
Ammas Donne Biriyani House,Biryani,"Indiranagar, Bangalore",100,,3
Tawakkal Mubarak Hotel,"Mughlai, Biryani","Old Airport Road, Bangalore",350,3.0,2
The Red Box,"Chinese, Thai","Indiranagar, Bangalore",250,,0
Biryani Blues,"Biryani, Kebab, Hyderabadi","Church Street, Bangalore",250,,3
Aubree,"Fast Food, Italian, Thai","MG Road, Bangalore",900,3.4,2
The Pizza Bakery - Brew & Eatery,"Pizza, Pasta, Italian, Continental, Fast Food, Salad, Desserts, Beverages","Indiranagar, Bangalore",800,4.6,4
Momoz,"Chinese, Momos, Burger","Jeevan Bhima Nagar, Bangalore",200,,0
The Dessert Zone,"Desserts, Bakery","Domlur, Bangalore",200,,3
Nando's,"Fast Food, Burger, Portuguese","Indiranagar, Bangalore",800,4.5,4
Chef Bakers,"Bakery, Fast Food, Pizza, Sandwich, Burger, Desserts","Marathahalli, Bangalore",400,,0
Bhartiya Jalpan,"North Indian, Street Food, Desserts, Beverages","Indiranagar, Bangalore",350,4.1,4
Mainland China,"Chinese, Asian, Seafood, Beverages","Church Street, Bangalore",1800,4.4,1
Hyderabad Chefs,"Andhra, North Indian, Chinese, Biryani","KBR Mall, Marathahalli, Bangalore",650,4.2,4
Toscano,"Italian, Pizza, Salad, Continental, Desserts, Beverages","Church Street, Bangalore",1200,2.9,2
Tomba Kitchens,"Naga, Chinese, Beverages","Ejipura, Bangalore",300,3.9,4
NH8,"Rajasthani, North Indian","Indiranagar, Bangalore",800,4.3,4
Chaatimes,Street Food,"Indiranagar, Bangalore",100,,0
Chichaba's Taj,"North Indian, Chinese, Desserts","Frazer Town, Bangalore",800,4.0,4
Lo! - Low Carb and Keto Foods,"Healthy Food, North Indian, Fast Food, Desserts","Domlur, Bangalore",150,,3
Sweet Truth - Cake and Desserts,Bakery,"Indiranagar, Bangalore",250,,3
Restaurant Chef Pillai,"South Indian, Seafood, Biryani","Whitefield, Bangalore",800,3.6,4
Venus Biryani,"Biryani, Chettinad","Domlur, Bangalore",300,2.9,2
Suchithra Biryani House,"Biryani, Andhra, North Indian, Chinese, Mughlai","Old Airport Road, Bangalore",800,3.9,4
Cafe Coffee Day,"Coffee, Fast Food, Desserts, Beverages","Indiranagar, Bangalore",600,3.1,2
Burnout Cafe,"Fast Food, Continental, Beverages, Desserts","Infantry Road, Bangalore",700,3.9,4
Apsara Ice Creams,"Ice Cream, Desserts","Indiranagar, Bangalore",400,4.3,4
Momo Zone - The Momo Company,"Momos, Fast Food","Domlur, Bangalore",150,,3
WOW! China,"Chinese, Rolls, Desserts, Shake","Church Street, Bangalore",600,3.8,4
Sendhoor Coffee,"Beverages, Street Food","Jeevan Bhima Nagar, Bangalore",200,4.1,0
Sri Venkateshwara Sweetmeat Stall,"Mithai, Street Food, Fast Food, North Indian","Majestic, Bangalore",400,4.0,4
KC Das - Sweet Bite,"Mithai, Street Food","Frazer Town, Bangalore",300,3.6,0
Chung Wah,"Chinese, Thai, Vietnamese","Residency Road, Bangalore",800,4.0,4
Srinidhi Veg Food Court,"South Indian, North Indian, Chinese, Fast Food, Street Food, Desserts, Beverages","Kalyan Nagar, Bangalore",300,3.8,0
Sri Srinivas Pork Hotel,Fast Food,"Ejipura, Bangalore",200,3.5,0
Momo Monk,Momos,"Jeevan Bhima Nagar, Bangalore",150,,0
Cream Stone,"Ice Cream, Desserts, Beverages, Shake","Domlur, Bangalore",150,,3
TrueCakes,Bakery,"Kammanahalli, Bangalore",300,,0
Paratha Box - 2X Filling,"North Indian, Beverages","Indiranagar, Bangalore",150,,3
Sri Banashankari Donne Biriyani,"Biryani, South Indian, Seafood","Banaswadi, Bangalore",300,3.6,0
BigBites,"Momos, Fast Food","Indiranagar, Bangalore",200,,3
Hamza Hotel,"North Indian, Chinese, Mughlai, Biryani","Shivajinagar, Bangalore",650,3.9,4
The Thick Shake Factory,"Beverages, Shake","Indiranagar, Bangalore",250,,0
Zomoz - The Momo Company,"Momos, Fast Food","Indiranagar, Bangalore",200,,3
Home Plate by EatFit,"North Indian, Beverages","Indiranagar, Bangalore",150,,3
Juicy,"Beverages, Juices, Desserts, Sandwich, Fast Food, Shake","Old Airport Road, Bangalore",400,4.0,4
Third Wave Coffee,"Fast Food, Beverages","Indiranagar, Bangalore",400,4.1,4
The Bengal Club,"Bengali, Biryani, Rolls","Domlur, Bangalore",200,,0
Srinidhi Sagar,"South Indian, North Indian, Chinese, Street Food, Shake","Old Airport Road, Bangalore",300,3.8,0
Saapaad,"South Indian, Biryani, Beverages","Koramangala 6th Block, Bangalore",350,4.1,4
Sri Ganesh Juice Junction,"Beverages, Juices, Fast Food, Shake","Koramangala 5th Block, Bangalore",50,,0
Bowl 99,"North Indian, Mughlai, Desserts","Thippasandra, Bangalore",300,,3
Preethi's Biryani Hub,"Biryani, South Indian, Beverages","Whitefield, Bangalore",300,,0
Gramin,"North Indian, Healthy Food, Beverages, Shake","Koramangala 7th Block, Bangalore",1000,4.3,1
Karama Restaurant,"Arabian, Mughlai, Seafood, North Indian, Biryani, Shake","Frazer Town, Bangalore",750,4.2,4
Hyderabadi Biryani Utsav,"Biryani, Hyderabadi, North Indian, Chinese","Old Madras Road, Bangalore",500,3.8,4
Daily Sushi,"Japanese, Korean, Sushi, Asian","Old Madras Road, Bangalore",200,,3
SLAY Coffee,"Beverages, Coffee","Indiranagar, Bangalore",150,,3
Sreeraj Lassi Bar,"Beverages, Shake, Ice Cream, Desserts","Commercial Street, Bangalore",300,3.8,0
New Taj Darbar,"North Indian, Chinese, Mughlai","Shivajinagar, Bangalore",300,2.5,2
The Filter Coffee,"South Indian, Coffee","Kalyan Nagar, Bangalore",300,4.3,4
Donne Biriyanis Junction,"Biryani, South Indian","Kammanahalli, Bangalore",200,,0
Taste Of Tibet,"Chinese, Street Food, Momos","Brigade Road, Bangalore",400,4.0,4
Main Lassi Shop,"Beverages, Ice Cream, Juices, Fast Food, Street Food, Sandwich, Shake","Shivajinagar, Bangalore",150,,0
Grow Fit,"Healthy Food, North Indian, Thai, Desserts, Beverages","Koramangala 6th Block, Bangalore",250,,3
Calcutta Victoria Chat House,"North Indian, Street Food, Desserts, Beverages","Jeevan Bhima Nagar, Bangalore",200,3.1,2
Milano Ice Cream,"Desserts, Ice Cream, Beverages, Shake","Indiranagar, Bangalore",400,4.9,4
Kanti Bakes & Flakes,"Bakery, Desserts, Mithai","Old Madras Road, Bangalore",50,,0
Kabab Biryani Corner,"North Indian, South Indian, Chinese","Richmond Road, Bangalore",450,3.2,2
Khichdi Express,North Indian,"Indiranagar, Bangalore",150,,0
Kunafa World,Desserts,"Frazer Town, Bangalore",400,3.9,4
Mane Holige,Mithai,"Koramangala 6th Block, Bangalore",200,,0
Cafe Grill,"Chinese, North Indian, Rolls","Jeevan Bhima Nagar, Bangalore",300,4.1,4
Manjit Da Dhaba,"North Indian, Desserts","Frazer Town, Bangalore",200,4.5,4
FB Cakes,"Bakery, Desserts","BTM, Bangalore",150,,0
Maven Kitchen,"Chinese, North Eastern, Beverages","Ejipura, Bangalore",500,3.8,4
Sree Krishna Kafe,"South Indian, Beverages","Koramangala 5th Block, Bangalore",350,4.4,4
Indiana Burgers,Burger,"Indiranagar, Bangalore",200,,3
Mother's Meal,"North Indian, Chinese","CV Raman Nagar, Bangalore",300,4.0,4
Punjabi Chaap Corner,"North Indian, Chinese, Fast Food","Indiranagar, Bangalore",650,4.0,4
Spicy Corner,"Rolls, Chinese, North Indian","Jeevan Bhima Nagar, Bangalore",100,,0
Srinathji's,"North Indian, Chinese, Pizza, Street Food, Beverages, Fast Food, Desserts","Indiranagar, Bangalore",800,3.7,4
No.10 Fort Cochin,"Seafood, Kerala, Biryani","St. Marks Road, Bangalore",800,3.8,4
Oh! Calcutta,"Bengali, Seafood, North Indian, Biryani, Finger Food","Church Street, Bangalore",1500,4.4,1
Shiv Sagar,"South Indian, North Indian, Oriental, Street Food, Desserts, Beverages, Shake","Banaswadi, Bangalore",300,3.3,2
Bombay Kulfi,"Ice Cream, Desserts","Banaswadi, Bangalore",300,,0
Khan Saheb Grills and Rolls,"North Indian, Rolls, Kebab, Mughlai, Biryani, Beverages","Indiranagar, Bangalore",500,4.2,4
The Brooklyn Creamery - Healthy Ice Cream,Ice Cream,"Indiranagar, Bangalore",200,,3
Mealful Rolls - Meals In A Roll,"Rolls, Fast Food","Indiranagar, Bangalore",200,,3
The Salad Studio,"Salad, Healthy Food","Indiranagar, Bangalore",400,2.9,2
Brik Oven,"Cafe, Fast Food, Italian, Desserts, Beverages","Indiranagar, Bangalore",1000,4.3,1
Arun Ice Creams,"Ice Cream, Desserts","Shivajinagar, Bangalore",50,,0
Raghavendra Tiffin,"Chinese, South Indian","Koramangala 1st Block, Bangalore",250,4.4,4
Maharaja Military Canteen,South Indian,"Cunningham Road, Bangalore",200,,3
Have More,"North Indian, Chinese, Beverages","Kammanahalli, Bangalore",700,3.9,4
Firangi Bake,"Italian, Mexican, Desserts","Indiranagar, Bangalore",250,,3
Savitha Family Restaurant,"North Indian, Chinese, Seafood, Beverages, Desserts, Mughlai","Koramangala 4th Block, Bangalore",500,3.7,4
Chaitra Restaurant,"North Indian, Chinese, Andhra, Biryani, Seafood, Fast Food","Kalyan Nagar, Bangalore",500,3.4,2
Natraj Chole Bhature,North Indian,"Indiranagar, Bangalore",200,3.9,0
Punjabi Unplugged,"North Indian, Chinese","Indiranagar, Bangalore",150,,3
Chinese BAE,"Chinese, Seafood, Momos","Jeevan Bhima Nagar, Bangalore",250,,0
Fanoos Xpress,"Rolls, Biryani, Fast Food, Arabian","Indiranagar, Bangalore",100,,0
Mizo Kitchen,"North Eastern, Chinese","Koramangala 5th Block, Bangalore",400,4.0,4
Bhojohori Manna,"Bengali, Desserts","Koramangala 6th Block, Bangalore",650,4.0,4
Absolute Shawarma,"Lebanese, Fast Food","Thippasandra, Bangalore",300,3.6,0
Smoke House Deli,"Italian, Pasta, Burger, Salad, Sandwich, Healthy Food, Juices, Beverages","Indiranagar, Bangalore",2000,4.6,1
LeanCrust Pizza - ThinCrust Experts,"Pizza, Fast Food, Beverages","Indiranagar, Bangalore",350,,3
Paratha Corner,North Indian,"CV Raman Nagar, Bangalore",300,3.5,0
Simply South By YummyEats,"South Indian, Kerala, Biryani","Koramangala 1st Block, Bangalore",200,,0
Kerala Mess,Kerala,"Indiranagar, Bangalore",200,3.3,2
Sri Krishna Nanda Gokul Veg Restaurant,"South Indian, North Indian, Chinese, Street Food, Beverages, Shake","Banaswadi, Bangalore",500,3.3,2
Udupi Food Point,"South Indian, North Indian, Chinese","Banaswadi, Bangalore",300,3.2,2
Biryanis,"Biryani, North Indian, South Indian, Mughlai, Andhra, Chinese, Beverages","Jeevan Bhima Nagar, Bangalore",500,3.6,0
Wheat Barn,"Pizza, Burger, Fast Food, Shake","Koramangala 6th Block, Bangalore",200,,3
Sweet Chariot,"Bakery, Desserts","Jeevan Bhima Nagar, Bangalore",50,,3
Shaap,"Kerala, Seafood","Indiranagar, Bangalore",500,3.8,4
Dhaba - Estd 1986 Delhi,"Mughlai, North Indian, Desserts","Indiranagar, Bangalore",2000,4.4,1
Indiranagar Social,"North Indian, Chinese, Biryani, Pizza, Salad, Kebab, Desserts, Beverages","Indiranagar, Bangalore",1500,4.0,1
Rang De Basanti Dhaba,"North Indian, Seafood, Mughlai, Desserts","Domlur, Bangalore",200,,3
Richie Rich,"Desserts, Beverages, Fast Food, Ice Cream, Shake","Race Course Road, Bangalore",450,3.9,4
