name,cuisines,area,averagecost,dinner ratings,cluster
Agarwal Mithai,"Street Food, North Indian, Beverages, Desserts","Electronic City, Bangalore",50,,3
Sweet Chariot,"Bakery, Desserts","Electronic City, Bangalore",400,2.9,2
Chikpet Donne Biryani House,"Biryani, South Indian","Bommasandra, Bangalore",300,,3
Indiana Burgers,Burger,"Electronic City, Bangalore",200,,3
Carlos Cake Cafe,"Bakery, Desserts","Electronic City, Bangalore",300,3.4,0
Sr Ambur Dum Biryani,"Biryani, South Indian","Bommasandra, Bangalore",250,2.7,2
Just Fresh Point,"Mithai, Fast Food, Sandwich, Desserts, Street Food","Electronic City, Bangalore",300,4.0,4
Itminaan Biryani - Dum Pukht,"Biryani, Mughlai, North Indian","Electronic City, Bangalore",250,,3
Juicy,"Beverages, Juices, Desserts, Sandwich, Fast Food, Shake","Electronic City, Bangalore",400,3.9,4
Third Wave Coffee,"Coffee, Cafe, Beverages, Fast Food","Bommasandra, Bangalore",250,,3
The Good Bowl,"North Indian, Mughlai","Electronic City, Bangalore",200,,0
Auntie Fung's,"Asian, Thai, Chinese, Vietnamese, Japanese, Indonesian, Burmese, Korean","Electronic City, Bangalore",300,,3
Hotel Sagar Samruddhi,"North Indian, South Indian","Electronic City, Bangalore",300,3.4,0
6am Biryani,"Biryani, South Indian","Electronic City, Bangalore",150,,0
Thani Kerala Hotel,"Kerala, South Indian, Biryani","Electronic City, Bangalore",300,3.3,2
UBQ By Barbeque Nation,"North Indian, Kebab, BBQ, Biryani","Electronic City, Bangalore",250,,3
Samosa Singh,Street Food,"Electronic City, Bangalore",150,,3
LeanCrust Pizza - ThinCrust Experts,"Pizza, Fast Food, Beverages","Electronic City, Bangalore",350,,3
SLAY Coffee,"Beverages, Coffee","Bommasandra, Bangalore",150,,3
Biggies Burger,"Fast Food, Burger, Beverages, Ice Cream","Electronic City, Bangalore",150,,0
Kolkata Famous Kati Roll,Rolls,"Electronic City, Bangalore",100,,0
NH1 Bowls - Highway To North,"North Indian, Kebab, Desserts","Bommasandra, Bangalore",200,,3
Mainland China,"Chinese, Asian, Seafood, Beverages","Electronic City, Bangalore",500,,0
Momo Monk,Momos,"Electronic City, Bangalore",150,,3
HBH Hyderabadi Biryani House,"Biryani, North Indian, Chinese, Hyderabadi","Bommasandra, Bangalore",450,3.8,4
The Pastry House,"Bakery, Desserts","Electronic City, Bangalore",400,3.3,2
Bullet Biryani,"Biryani, Kebab, Andhra","Electronic City, Bangalore",150,,3
Lassi Corner,"Beverages, Desserts, Fast Food, Ice Cream, Shake","Electronic City, Bangalore",250,3.5,0
Delhi Base Sri Food Court,"North Indian, Chinese","Electronic City, Bangalore",300,4.1,4
Sri Vishnu Upahar,"North Indian, South Indian, Chinese, Beverages","Bommasandra, Bangalore",500,3.4,2
Nadan Pothichoru,"Kerala, South Indian, Beverages","Bommanahalli, Bangalore",150,,3
Bismillah Star  Ambur Biryani,"Biryani, North Indian","Electronic City, Bangalore",250,3.5,0
Keventers Ice Cream,"Ice Cream, Desserts, Shake, Beverages","Electronic City, Bangalore",300,,0
Simply Veg,"South Indian, North Indian, Chinese","Electronic City, Bangalore",300,3.6,0
MBR Dum Biryani County,"Chinese, Rolls, North Indian","Bommasandra, Bangalore",300,3.6,0
Srinidhi Udupi Upahar,"South Indian, Chinese, Street Food, Beverages","Bommasandra, Bangalore",350,,0
Delhi Base,"North Indian, Chinese, Beverages, Street Food","Electronic City, Bangalore",300,3.5,0
Taiki,Japanese,"Bommasandra, Bangalore",200,,3
Habibi Falafel,"Arabian, Beverages, Fast Food","Electronic City, Bangalore",550,3.8,4
Firangi Bake,"Italian, Mexican, Desserts","Electronic City, Bangalore",250,,3
Mealful Rolls - Meals In A Roll,"Rolls, Fast Food","Bommasandra, Bangalore",200,,3
DVG Benne Dosa,"South Indian, Street Food","Electronic City, Bangalore",200,3.7,0
SGS Non Veg Gundu Palav,"South Indian, Chinese","Electronic City, Bangalore",400,3.6,0
Baker's Home Cakes & Desserts,"Bakery, Beverages","Electronic City, Bangalore",400,,3
Rasogolla,"Mithai, Street Food","Electronic City, Bangalore",200,,0
Popular Burger,"Burger, Sandwich, Rolls, Wraps","Electronic City, Bangalore",250,4.1,0
Pizzarea Zone,"Pizza, Sandwich, Fast Food","Electronic City, Bangalore",200,,0
South Magic,South Indian,"Electronic City, Bangalore",100,,3
Taste Of Malabar,"South Indian, Chinese","Electronic City, Bangalore",150,,0
Maa Reddy's Hyderabadi Biryani House,"Biryani, North Indian, Mughlai, Chinese","Electronic City, Bangalore",400,4.0,4
Food Court By Kitchens@,"North Indian, South Indian, Chinese, Mughlai, Biryani, Momos, Desserts, Beverages","Electronic City, Bangalore",150,,3
Cake Dilim,"Bakery, Fast Food, Desserts","Bommasandra, Bangalore",500,,0
Dine Garden Family Restaurant,"Biryani, North Indian, Chinese, Kerala","Electronic City, Bangalore",500,3.9,4
Eat N Meet,"Kerala, South Indian, North Indian, Chinese, Beverages","Bommasandra, Bangalore",500,2.9,2
The Momo Co.,"Chinese, Momos, Desserts, Beverages","Electronic City, Bangalore",200,,3
Bangarpet Chats,Street Food,"Electronic City, Bangalore",100,,0
Time Traveller - Sai Vishram,"Continental, North Indian, South Indian, Chinese","Electronic City, Bangalore",1400,4.4,1
Bombay Kulfis,"Desserts, Ice Cream","Electronic City, Bangalore",200,,0
Onebite,"Fast Food, Pizza, Beverages","Electronic City, Bangalore",550,,4
Hyderabad Darbar,"Andhra, South Indian, Chinese","Electronic City, Bangalore",700,3.6,4
SFC Kabab Corner,"Chinese, North Indian, Mughlai","Bommasandra, Bangalore",350,3.7,0
Haka,"Chinese, Momos","Electronic City, Bangalore",300,,0
Jai Maruthi 99 Variety Dosa & Pav Bhaji Corner,"South Indian, Street Food","Electronic City, Bangalore",200,,0
Kouzina Kafe - The Food Court,"Fast Food, Bakery, Desserts","Electronic City, Bangalore",200,,3
City Lights,"Chinese, South Indian, Street Food","Electronic City, Bangalore",100,,3
The Hotel Nalanda,"South Indian, Biryani, Mughlai, Chinese, North Indian","Bommasandra, Bangalore",600,3.0,2
Grow Fit,"Healthy Food, North Indian, Thai, Desserts, Beverages","Electronic City, Bangalore",250,,3
Aahaar Veg,"South Indian, Street Food","Electronic City, Bangalore",100,,0
Shoiab Family Restaurant,"North Indian, South Indian, Chinese, Rolls","Electronic City, Bangalore",800,3.7,4
Paratha Box - 2X Filling,"North Indian, Desserts, Beverages","Electronic City, Bangalore",150,,0
NOTO- Healthy ice cream,"Ice Cream, Desserts","Electronic City, Bangalore",100,,3
Cupcake Noggins,Bakery,"Electronic City, Bangalore",150,,3
ITC Master Chef Creations,"North Indian, Mediterranean, Mughlai, Desserts","Bommasandra, Bangalore",350,,0
Nashta Cafe,"North Indian, Street Food, South Indian","Electronic City, Bangalore",50,,3
Paris Panini - French Street Food,"French, Continental, Sandwich, Panini, Beverages, Desserts","Hosur Road, Bangalore",250,,3
Bangaliana,"Bengali, Seafood","Electronic City, Bangalore",600,2.7,2
MDP Coffee House,"South Indian, Beverages","Electronic City, Bangalore",200,3.8,0
New Ambur Hot Dum Biriyani,"Biryani, Fast Food","Bommasandra, Bangalore",300,,0
Hiyar Majhe Kolkata,"Bengali, North Indian, Chinese, Biryani","Electronic City, Bangalore",150,,0
Simply Dosa,South Indian,"Electronic City, Bangalore",100,,3
Curry On Tikka,"North Indian, Mughlai, Fast Food, Kebab","Electronic City, Bangalore",250,,0
Globo Ice Creams of the World,Ice Cream,"Electronic City, Bangalore",100,,3
Reddy Restaurant,South Indian,"Electronic City, Bangalore",300,3.1,2
Baba Ganoush Cafe,"Fast Food, Arabian, Lebanese, Beverages","Bommasandra, Bangalore",500,3.4,2
Burger Zone,"Fast Food, Burger, Sandwich","Electronic City, Bangalore",150,,3
Pizzology Pizza,"Fast Food, Pasta, Pizza, Beverages","Electronic City, Bangalore",550,4.0,4
New Taaza Thindi,"South Indian, North Indian, Chinese","Electronic City, Bangalore",250,3.4,0
Ambur RR Biriyani,Biryani,"Bommasandra, Bangalore",100,,0
Pizza 997 AD,"Pizza, Fast Food, Desserts","Electronic City, Bangalore",350,,3
Snack House,"Fast Food, Momos, Street Food","Electronic City, Bangalore",150,,3
Hyderabadi Biriyani House,"Biryani, Seafood, North Indian, Chinese","Electronic City, Bangalore",200,,3
Iyengars Oven Fresh,Bakery,"Electronic City, Bangalore",300,3.0,2
Chandni Chowk,"Street Food, North Indian, Mithai","Electronic City, Bangalore",150,,3
Renuka Upahara,"North Indian, South Indian, Street Food, Ice Cream, Chinese, Beverages","Electronic City, Bangalore",400,,0
Sundae Everyday Ice Creams,"Ice Cream, Shake","Electronic City, Bangalore",150,,3
Asia Kitchen By Mainland China,"Chinese, Momos, Thai, Asian, Seafood, Sushi, Beverages","Electronic City, Bangalore",400,,0
Oregano,"Pizza, Italian, Fast Food, Beverages","Bommasandra, Bangalore",500,3.4,2
Hotel Swarajya,"Maharashtrian, North Indian, Chinese, Beverages","Electronic City, Bangalore",800,3.9,4
Chikmagalur Coffee Thindi Mane,"South Indian, Beverages","Bommasandra, Bangalore",150,3.6,0
Foodies Express,"Chinese, North Indian, Arabian, Biryani","Electronic City, Bangalore",400,3.4,2
Momo Monk,"Momos, Beverages","Electronic City, Bangalore",150,,3
Magic Bowl,"North Indian, Chinese, Arabian, Mughlai","Electronic City, Bangalore",700,3.2,2
Home Plate by EatFit,"North Indian, Beverages","Electronic City, Bangalore",150,,3
Hyderabadi Biryani Box,"Biryani, Chinese, BBQ, Seafood","Electronic City, Bangalore",400,3.3,2
Donne Biriyanis Junction,Biryani,"Electronic City, Bangalore",200,,3
Achayans Pride,Kerala,"Electronic City, Bangalore",150,,3
Hot Attack,"North Indian, Chinese, Biryani","Electronic City, Bangalore",500,3.7,4
Fire Station,"Finger Food, North Indian, Continental, Italian, Chinese, Beverages, Desserts","Electronic City, Bangalore",1400,4.3,1
Bite Me Cupcakes ,"Desserts, Bakery","Electronic City, Bangalore",150,,3
ITC Sunfeast Baked Creations,"Bakery, Desserts, Sandwich","Bommasandra, Bangalore",250,,3
Vadilal Ice Cream,"Ice Cream, Desserts","Electronic City, Bangalore",100,,3
Kolkata Durbar,"Biryani, Bengali, North Indian, Mughlai, Rolls","Electronic City, Bangalore",150,,3
Paris Waffle Co. ,Desserts,"Electronic City, Bangalore",200,,3
Oh! Calcutta,"Bengali, Seafood, North Indian, Biryani, Finger Food","Electronic City, Bangalore",350,,0
Italian Pizza House,"Pizza, Fast Food","Electronic City, Bangalore",250,,3
32 Degree,"Sandwich, Juices, Fast Food, Beverages","Electronic City, Bangalore",200,,0
Shawarmafia,"Lebanese, Chinese","Electronic City, Bangalore",200,,0
Sri Maha Bengali Hotel,"Bengali, Rolls, Chinese, Biryani, North Indian","Bommasandra, Bangalore",400,3.4,2
Ruchi Sagar,"South Indian, North Indian, Chinese, Street Food, Ice Cream, Beverages","Electronic City, Bangalore",300,3.9,4
Burger It Up,Burger,"Electronic City, Bangalore",200,,3
Chai Resto,"Beverages, Fast Food, North Indian","Electronic City, Bangalore",100,,0
Sandwich Spot 'N' Juicy,"Sandwich, Fast Food, Chinese, Juices, Beverages, Desserts","Electronic City, Bangalore",250,3.5,0
Momo's King ,Momos,"Electronic City, Bangalore",150,,3
Wrap 'N' Roll,"Rolls, Chinese","Electronic City, Bangalore",150,,0
New Biryani Hotel,"Biryani, Chinese, North Indian, Rolls, South Indian","Electronic City, Bangalore",150,,3
The Big Barbeque,"North Indian, Mughlai, Kebab, Pasta, Chinese","Electronic City, Bangalore",1000,4.5,1
The Dessert Corner,"Desserts, Bakery","Electronic City, Bangalore",150,,3
Shankars Kitchen,"North Indian, South Indian, Chinese, Beverages, Shake","Bommasandra, Bangalore",800,3.1,2
Brahmin Veg Cafe,"Beverages, Juices, Shake","Electronic City, Bangalore",200,,0
Sugo,North Indian,"Electronic City, Bangalore",200,,3
McCafe by McDonald's,"Coffee, Desserts, Beverages","Bommanahalli, Bangalore",500,3.1,2
Slurpy Shakes,"Beverages, Burger, Fast Food, Bakery, Shake","Electronic City, Bangalore",200,,3
 The Crowne Plaza,"Chinese, North Indian, Seafood, Fast Food, Beverages","Electronic City, Bangalore",150,,3
Donne Biryani House,"Biryani, South Indian","Electronic City, Bangalore",400,,0
Sitaar,"North Indian, Chinese, South Indian, Biryani, Desserts, Beverages, Shake","Bommasandra, Bangalore",800,3.5,4
RJ Kitchen,"Biryani, Chinese","Electronic City, Bangalore",300,3.6,0
Mast Marathi,"Maharashtrian, Street Food, Beverages, Desserts","Electronic City, Bangalore",150,,0
Kwality Wall’s Frozen Dessert and Ice Cream Shop,"Desserts, Ice Cream","Electronic City, Bangalore",100,,3
Bay Leaf Cafe & Restaurant,"Chinese, Fast Food","Bommasandra, Bangalore",350,,0
New Punjabi Tadka,"North Indian, Mughlai, Chinese","Electronic City, Bangalore",550,3.5,0
Hotel RK Gardenia,"South Indian, North Indian, Chinese","Bommasandra, Bangalore",600,,4
Wow Manglore Multi Cuisine Restaurant,"Fast Food, South Indian, Mangalorean, North Indian","Bommasandra, Bangalore",300,3.5,0
Edesia by Freshmenu,"Bakery, Desserts","Bommanahalli, Bangalore",100,,3
Malnad Cafe,"Fast Food, Desserts, Beverages, Shake","Bommasandra, Bangalore",150,,3
Pattikattan Biriyani,"Chettinad, South Indian","Electronic City, Bangalore",300,4.1,4
Pushpa Samosa Shop,"Street Food, Mithai","Electronic City, Bangalore",50,,0
Food House,"North Indian, Chinese, Fast Food, Rolls, Biryani","Bommasandra, Bangalore",300,,0
Hotel Hallimane,"Biryani, Seafood, South Indian","Bommasandra, Bangalore",450,3.8,4
Ambur Biriyani,"Biryani, South Indian, Chinese, North Indian","Electronic City, Bangalore",200,,0
Tandoor Hut And Mane Biryani,"South Indian, Biryani","Electronic City, Bangalore",200,,3
Achayans Cafe,"Kerala, Biryani","Electronic City, Bangalore",150,,0
Seasons,"North Indian, South Indian, Chinese, Seafood, Kerala, Arabian, Desserts, Beverages","Electronic City, Bangalore",1000,2.9,2
Shaan-e-Punjab,"Mughlai, North Indian","Bommasandra, Bangalore",250,,3
Vinaya Royal Inn,"North Indian, Chinese, Shake, Beverages","Electronic City, Bangalore",800,3.0,2
Onvi's Soup Station,"Healthy Food, Continental","Electronic City, Bangalore",150,,3
Canteen Central - Pizzas & Pastas,"North Indian, South Indian","Electronic City, Bangalore",200,,3
Cake Studio,Bakery,"Electronic City, Bangalore",150,,0
The Bangalore Creamery,"Ice Cream, Desserts, Beverages, Shake, Waffle","Electronic City, Bangalore",150,,3
Zwarma ,Lebanese,"Electronic City, Bangalore",300,,0
Burger Cafe,"Fast Food, Burger","Electronic City, Bangalore",150,,3
Kolkata Famous Kati Roll,Rolls,"Electronic City, Bangalore",100,,0
Amo La Pizza (Wood Fired),"Pizza, Fast Food, Pasta","Electronic City, Bangalore",300,3.5,0
Hotel Sagar Samruddhi Biriyani House,"Biryani, Chinese, North Indian","Electronic City, Bangalore",350,,0
Hi-Tech Malabari Restaurant,"Kerala, South Indian","Electronic City, Bangalore",250,3.4,0
Juice N Burger,"Beverages, Shake, Fast Food, Ice Cream","Electronic City, Bangalore",100,,0
Curries 'N' Phulkas,North Indian,"Electronic City, Bangalore",100,,0
Pizza Republic,"Pizza, Fast Food","Bommasandra, Bangalore",550,3.9,4
ShakeShack,"Beverages, Shake","Electronic City, Bangalore",150,,3
Lassi Paradise,"Beverages, Desserts, Fast Food, Shake","Electronic City, Bangalore",200,3.7,0
Ruposhi Bangla,"Bengali, Chinese, North Indian, Seafood","Electronic City, Bangalore",400,3.1,2
Silver Dine By Shankar's Kitchen,"Seafood, North Indian, Biryani, Chinese, Shake","Bommasandra, Bangalore",750,3.4,2
Aromas Of China,Chinese,"Electronic City, Bangalore",250,,3
SM Food Court,"Mughlai, North Indian, Chinese","Electronic City, Bangalore",150,,3
Wow Marathi,"Maharashtrian, Street Food, North Indian, Beverages","Electronic City, Bangalore",100,,3
Fudgebob,"Bakery, Desserts","Electronic City, Bangalore",250,,3
Today Coffee,South Indian,"Electronic City, Bangalore",100,3.9,0
BigBites,"Fast Food, Street Food, Momos","Electronic City, Bangalore",200,,3
Bullet Biryani,"Biryani, Kebab, Andhra","Electronic City, Bangalore",150,,3
Rolls & Bowls Company,"Rolls, North Indian, Chinese, Fast Food","Electronic City, Bangalore",250,,3
Pure Veg Meals By LunchBox,"North Indian, Shake","Electronic City, Bangalore",200,,3
Datta Bhel Asmi's Kitchen,Street Food,"Electronic City, Bangalore",200,,0
Cake Hopper,"Bakery, Beverages, Shake","Electronic City, Bangalore",400,,3
Northern Bhatti Restaurant,"Chinese, North Indian, Street Food","Electronic City, Bangalore",100,,0
Hot Spot Family Restaurant,"North Indian, Chinese, Shake","Electronic City, Bangalore",350,2.6,2
The Indian Samosa,"Street Food, North Indian, Fast Food, Beverages","Electronic City, Bangalore",100,,0
Heaven In A Jar,Desserts,"Electronic City, Bangalore",150,,3
Desi Dhaba,North Indian,"Electronic City, Bangalore",250,,3
Carlos Cakes,Bakery,"Bommasandra, Bangalore",400,,0
Yalavarthi's Kitchen Spicy Den,"North Indian, Fast Food, Juices","Electronic City, Bangalore",300,,0
Sri Udupi Vaibhava,"North Indian, South Indian, Chinese, Street Food","Electronic City, Bangalore",300,,0
Hotel SLN,"North Indian, South Indian, Chinese","Electronic City, Bangalore",400,3.4,2
Adams Burgers,"Burger, Fast Food, Beverages","Electronic City, Bangalore",400,,0
Biriyani Only,"Biryani, South Indian, Beverages","Electronic City, Bangalore",100,,3
BLR Brewing Co.,"Finger Food, North Indian, Continental, Mughlai, Chinese, Desserts, Beverages","Electronic City, Bangalore",1500,4.4,1
MAD Belgian Waffles,Desserts,"Electronic City, Bangalore",200,,0
Parampara - The Veg Kitchen,"North Indian, Chinese, Street Food, Desserts","Electronic City, Bangalore",350,2.9,2
Shree Jodhpur Sweets,"Mithai, Street Food","Electronic City, Bangalore",50,,0
Donne Biryani Grand,"Biryani, South Indian","Electronic City, Bangalore",300,,0
Foodies Family Restaurant,"North Indian, Chinese, Mughlai, Seafood, Shake","Bommasandra, Bangalore",500,3.4,2
Megana Biryani Zone,"Biryani, Andhra, Chinese, North Indian, Seafood, Desserts, Beverages, Shake","Bommanahalli, Bangalore",200,,0
Tea Time,"Tea, Shake, Beverages","Electronic City, Bangalore",250,,0
Magic Moms,"Chinese, Momos","Electronic City, Bangalore",100,,3
BigBites,"Fast Food, Momos, Street Food","Electronic City, Bangalore",200,,3
Scoopy Doo,"Ice Cream, Desserts, Shake, Fast Food, Beverages","Electronic City, Bangalore",300,4.0,4
Hello Biriyani & Curries,"Biryani, Chinese, South Indian, Andhra","Electronic City, Bangalore",500,3.3,2
Waffl'd,"Waffle, Desserts, Beverages, Ice Cream, Bakery","Electronic City, Bangalore",150,,3
Casa Piccosa,"North Indian, Italian, Chinese, Desserts","Bommasandra, Bangalore",1100,3.6,4
4Foodiez,"South Indian, North Indian, Chinese","Electronic City, Bangalore",300,3.7,0
North Indian Kitchen ,"Chinese, Rolls, North Indian","Electronic City, Bangalore",300,,0
Chung Wah,"Chinese, Thai, Asian","Electronic City, Bangalore",250,,3
Kolkata Kati Roll,"Fast Food, Rolls","Electronic City, Bangalore",100,,0
Ambur Biryani,"Biryani, South Indian, Beverages","Electronic City, Bangalore",100,,0
Chalu Chinese ,"Chinese, BBQ","Electronic City, Bangalore",150,,3
Tandoori Cha,"Street Food, Beverages","Bommasandra, Bangalore",150,,0
Empiar's Restaurant,"North Indian, Chinese, Biryani","Electronic City, Bangalore",250,,0
Sri Durga Dose Mane,South Indian,"Bommanahalli, Bangalore",150,,0
Mount Sales,Bakery,"Electronic City, Bangalore",100,,3
Samosas King,"Street Food, Beverages","Electronic City, Bangalore",100,,3
Bombay 2 Delhi,Street Food,"Electronic City, Bangalore",100,,3
New Hyderabadi Biryani Box,"North Indian, Chinese, Biryani","Electronic City, Bangalore",200,,0
Firdaus Biryani,"Biryani, North Indian, Mughlai","Electronic City, Bangalore",300,,0
Panjabi Tadka,"North Indian, Chinese, Mughlai, Biryani","Electronic City, Bangalore",250,,0
Sankalp Reddy Restaurant,"South Indian, Andhra, Biryani","Electronic City, Bangalore",300,3.7,0
Lassi Parlour,"Beverages, Ice Cream, Fast Food, Shake, Sandwich","Electronic City, Bangalore",150,3.6,0
Bowl Soul,"Fast Food, Beverages","Electronic City, Bangalore",250,,3
GetAWhey - Healthy Ice Creams,"Ice Cream, Healthy Food","Electronic City, Bangalore",150,,3
Nisarga Gokula Veg Restaurant,South Indian,"Electronic City, Bangalore",200,3.3,2
Grills N Barbeque,"North Indian, Chinese, Biryani","Electronic City, Bangalore",200,,0
Walleve,"Bakery, Desserts, Fast Food","Electronic City, Bangalore",400,3.8,4
Big Biriyani Company,"Biryani, North Indian, Mughlai","Electronic City, Bangalore",150,,3
Shakes And Bites,"Fast Food, Desserts, Beverages, Shake","Electronic City, Bangalore",300,2.9,2
Paddu Corner,South Indian,"Electronic City, Bangalore",100,,0
Popular Kitchen,"North Indian, Chinese, South Indian, Fast Food, Beverages, Desserts","Bommasandra, Bangalore",100,,3
Delhi Ka Chulha,"Chinese, North Indian, Street Food","Electronic City, Bangalore",300,,0
Om Sweets & Namkeens,"Mithai, Street Food, North Indian, Beverages","Electronic City, Bangalore",200,3.7,0
Juicy Crush,"Juices, Beverages, Salad, Rolls, Sandwich, Fast Food, Ice Cream, Desserts","Electronic City, Bangalore",200,,0
DFC Home Made Veg And Nonveg Restaurant,"South Indian, Mughlai, North Indian","Electronic City, Bangalore",50,,3
Thalassery Junction Restaurant,"South Indian, Chinese, Arabian","Electronic City, Bangalore",150,,3
Big Mishra Pedha,"Mithai, Street Food","Electronic City, Bangalore",100,,0
So-bur,Burger,"Bommasandra, Bangalore",500,,0
New Paratha Kitchen,"North Indian, Rolls, Chinese, South Indian","Electronic City, Bangalore",150,,0
Sai Saagar ,South Indian,"Electronic City, Bangalore",100,,3
Mom's Pot Family Restaurant,"Biryani, North Indian, Rolls, Kebab, Salad, Kerala","Bommasandra, Bangalore",300,,0
House Of Biryani And Tandoori,"Biryani, Kebab, Mughlai","Electronic City, Bangalore",300,,0
Lal Qila Restaurant,"North Indian, Biryani, Chinese, Fast Food","Electronic City, Bangalore",250,,3
Cafe Kolkata's,"Asian, Chinese","Bommasandra, Bangalore",200,,3
Fresh Juice And Chats,"Street Food, Fast Food, Beverages","Electronic City, Bangalore",50,,0
Dil Dhaar Punjabi,"Chinese, Momos, Street Food, North Indian, Beverages","Electronic City, Bangalore",100,,3
Trippy Cakes,Desserts,"Electronic City, Bangalore",300,,3
The Krishna Punjabi,"North Indian, Chinese, Biryani, Mughlai, Seafood","Electronic City, Bangalore",200,,3
Live Kitchen,"North Indian, South Indian, Beverages","Electronic City, Bangalore",100,,0
Star Punjab,"North Indian, South Indian","HSR, Bangalore",150,,3
Ambur Chicken Biryani Hyderabadi Special,"Biryani, Kebab, Chinese","Electronic City, Bangalore",250,,0
Flying Apron,Bakery,"Electronic City, Bangalore",100,,0
Meisterwurst,"Burger, Sandwich, Fast Food","Electronic City, Bangalore",300,,3
Khan Sahab,"Biryani, North Indian","Electronic City, Bangalore",250,,3
The Biryani And Kebab House,Chinese,"Electronic City, Bangalore",100,,0
Curry Point's,North Indian,"Electronic City, Bangalore",150,,3
Desi Chaat Bazzaar,"Street Food, Beverages","Electronic City, Bangalore",250,3.9,0
Biryani Mandi,"Biryani, North Indian","Electronic City, Bangalore",150,,3
SRR Ambur Dum Biryani,"Biryani, South Indian","Bommasandra, Bangalore",200,,0
Chinese Chings,Chinese,"Electronic City, Bangalore",250,,3
24/7 Restaurant,"Mughlai, Chinese, North Indian","Electronic City, Bangalore",100,,3
Chinese Spice,Chinese,"Electronic City, Bangalore",200,,3
VBM Chai Adda,"Street Food, Tea, Juices, Beverages, Shake","Electronic City, Bangalore",100,,0
American Burger,"Fast Food, Burger","Electronic City, Bangalore",150,,3
Chinese Hangout,Chinese,"Electronic City, Bangalore",250,,0
Night Fox,"North Indian, Chinese, Biryani, Shake","Bommanahalli, Bangalore",150,,0
Fried Hub,"Fast Food, Burger","Electronic City, Bangalore",350,,0
Biryani Mahal,"Biryani, Chinese","Electronic City, Bangalore",150,,3
The Brooklyn Creamery - Healthy Ice Cream,"Ice Cream, Desserts","Electronic City, Bangalore",200,,3
Lassi Resto Cafe,"Beverages, Shake, Ice Cream","Electronic City, Bangalore",200,3.6,0
BBQ Night 1996,"Biryani, Kebab, North Indian","Electronic City, Bangalore",200,,3
Naati Mane,"South Indian, Fast Food","Electronic City, Bangalore",250,3.6,0
Chinese Sizzler,Chinese,"Electronic City, Bangalore",250,,3
Yummy Delights,Biryani,"Electronic City, Bangalore",150,,3
Pepper Pot Restaurant,"South Indian, North Indian, Chinese","Electronic City, Bangalore",150,,0
3B's Cafe,"Burger, Sandwich, Fast Food, Ice Cream, Beverages, Shake","Electronic City, Bangalore",150,,3
Santripti,"North Indian, Chinese, Fast Food","Electronic City, Bangalore",800,3.4,2
Roti Ghar Ka ,"North Indian, Biryani, Chinese","Electronic City, Bangalore",250,,0
Hyderabadi Kitchens,"Andhra, Hyderabadi, Seafood, Beverages","Electronic City, Bangalore",250,,0
Hello Cafe,"Fast Food, Burger, Biryani, Rolls, Shake","Electronic City, Bangalore",300,3.7,0
Hotel Manarama,"North Indian, Odia","Electronic City, Bangalore",300,3.8,0
Nest Restaurant ,Chinese,"Electronic City, Bangalore",400,,0
Mehfil-E-Biryani ,"Biryani, Kebab","Electronic City, Bangalore",250,,3
Indian Food Court,"North Indian, Chinese, Fast Food","Electronic City, Bangalore",400,3.8,4
Vijay Masth Biriyani House ,"Biryani, Chinese","Electronic City, Bangalore",200,,0
Aligarh Biryani ,Biryani,"Electronic City, Bangalore",250,,3
Momo Zone,"Chinese, Momos","Electronic City, Bangalore",250,,3
Delhi Style Restaurant,North Indian,"Electronic City, Bangalore",100,,3
Sri Banashankari Donne Biriyani,"Biryani, North Indian, Chinese","Electronic City, Bangalore",300,,0
Pizzaazz By What the Ale?!,Pizza,"Electronic City, Bangalore",300,,3
Andhra Meals,Andhra,"Electronic City, Bangalore",200,,3
Belgaum Biryani,"Biryani, North Indian","Electronic City, Bangalore",350,,0
Green Chilli Dhaba,"Chinese, Biryani","Bommasandra, Bangalore",200,,3
Rajdhani Restaurant,"North Indian, Chinese, Mughlai","Electronic City, Bangalore",250,,3
Donburi,"Chinese, Fast Food","Electronic City, Bangalore",250,,3
Rolls And Smoothies Adda,"Rolls, Beverages, Shake","Electronic City, Bangalore",400,3.1,2
Davanagere Butter Dosa,South Indian,"Electronic City, Bangalore",100,,3
Amaravathi Biryani Zone,"Biryani, Chinese","HSR, Bangalore",200,,3
Hyderabadi Biryani's,"Rolls, Chinese, North Indian, South Indian, Fast Food, Ice Cream, Beverages","Bommanahalli, Bangalore",200,,0
Voosh Dakshin,South Indian,"Electronic City, Bangalore",150,,3
Peppy Paratha by Chai Point,"North Indian, Rolls","Bommanahalli, Bangalore",150,,3
Mutton Junction,"North Indian, Mughlai","Electronic City, Bangalore",200,,3
