name,cuisines,area,averagecost,dinner ratings,cluster
Momo's Point,"Chinese, Momos","Marathahalli, Bangalore",250,,3
Chini Mirchi Indo-Chinese Kitchen,Chinese,"ITPL Main Road, Whitefield, Bangalore",200,,0
Bihari Bhojan,"North Indian, Biryani, Chinese","Marathahalli, Bangalore",250,,3
Delhi Kitchen,"North Indian, Odia, Chinese, Beverages","Whitefield, Bangalore",300,,0
Meghana Foods,"Biryani, Andhra, North Indian, Seafood","Brookefield, Bangalore",300,,3
Five Star Chicken,"Wraps, Burger, Rolls, Fast Food, Street Food","KR Puram, Bangalore",100,,0
Andhra Gunpowder,"Biryani, South Indian, Desserts, Beverages","Whitefield, Bangalore",200,,3
Beijing Bites,"Chinese, Thai, Seafood, Healthy Food","Varthur Main Road, Whitefield, Bangalore",250,,3
Hyderabadi Handi Biryani,"Andhra, Biryani, Chinese, North Indian","Whitefield, Bangalore",200,,3
Madras Meal Company,"South Indian, Chettinad","Whitefield, Bangalore",150,,3
Hyderabadi Kitchen,"Biryani, Chinese, Hyderabadi","Whitefield, Bangalore",150,,3
Lassi Corner,"Beverages, Desserts, Fast Food, Ice Cream, Shake","KR Puram, Bangalore",100,,0
The Punjabi Rasoi,"Mughlai, North Indian, Chinese","Whitefield, Bangalore",800,4.4,4
Andhra Biryanis,"Biryani, Andhra, North Indian","Whitefield, Bangalore",700,4.0,4
Hotel Godavari,"North Indian, Andhra, Chinese, Biryani, Seafood","Brookefield, Bangalore",700,3.0,2
Tadka Punjabi Restaurant,"North Indian, Chinese, Biryani","Whitefield, Bangalore",600,3.6,4
Dil Se Dilli,"North Indian, Mughlai, Rolls","Whitefield, Bangalore",700,3.9,4
Khawar Ashe Pashe,"Bengali, Biryani, North Indian, Chinese, Fast Food, Rolls","KR Puram, Bangalore",150,,0
Andhra Kafe,"Lucknowi, South Indian, North Indian, Beverages, Ice Cream, Andhra","ITPL Main Road, Whitefield, Bangalore",1000,3.2,2
Chaat Cafe,"Street Food, North Indian, Beverages","Whitefield, Bangalore",100,,3
Surabhi Hut,"North Indian, Chinese, South Indian, Biryani","Whitefield, Bangalore",150,,3
Jubli Biryani,"Andhra, Biryani, Chinese, North Indian, Kebab","ITPL Main Road, Whitefield, Bangalore",450,,4
Sri Chowdeshwari Mudde Hotel,"South Indian, Biryani","Whitefield, Bangalore",300,,0
Food Connections,"Fast Food, Beverages, Shake","Whitefield, Bangalore",100,,0
New Punjabi Tasty Khana,"North Indian, Biryani, Chinese","Whitefield, Bangalore",400,2.7,2
Udupi Veg,"South Indian, Chinese","Whitefield, Bangalore",300,,0
Carry Out,"Burger, Sandwich, Wraps, Fast Food, Shake","Whitefield, Bangalore",100,,3
Koli Hut,South Indian,"Whitefield, Bangalore",400,,0
Biryani Khazana,"Biryani, Desserts","Whitefield, Bangalore",350,,3
Laali Da Dhaba,"Chinese, North Indian, Fast Food","Brookefield, Bangalore",150,,3
Spicy Dates,"Chinese, North Indian, Beverages, Shake, Street Food","KR Puram, Bangalore",150,,0
CSR Chicken Centre And Foods,"South Indian, Raw Meats","KR Puram, Bangalore",150,,3
Carry Bottle,"Beverages, Shake","ITPL Main Road, Whitefield, Bangalore",150,,0
Roti Curry & Co,"North Indian, Desserts","Whitefield, Bangalore",300,,3
Angaar Biryani,"North Indian, Biryani, Chinese, Mughlai","Whitefield, Bangalore",500,,4
Shree Sharana Basaveshwara Khanavali,"North Indian, South Indian","BTM, Bangalore",200,,0
Biryani Express,Biryani,"Whitefield, Bangalore",300,,0
Vindoos Stop And Eat,"South Indian, North Indian, Beverages, Fast Food","Whitefield, Bangalore",100,,0
Dan's Eatery & Creamy,"Chinese, Fast Food","Whitefield, Bangalore",250,3.6,0
RR Kabab Corner,"North Indian, Chinese, Bengali","Marathahalli, Bangalore",350,3.8,4
Apna Hotel,"North Indian, Mughlai","Whitefield, Bangalore",350,3.6,0
Treat,"North Indian, Desserts, Beverages","Whitefield, Bangalore",250,,0
Yummy Pots,"Fast Food, Street Food, Ice Cream","KR Puram, Bangalore",150,,0
Sri Balaji Andhra Mess,Andhra,"Whitefield, Bangalore",250,3.4,0
Herbs & Spices-Curries,South Indian,"Whitefield, Bangalore",150,,3
Shake Tastic,"Beverages, Juices, Shake","Brookefield, Bangalore",150,,3
Momopoly,"Chinese, Wraps, Beverages","Brookefield, Bangalore",200,,3
Dal Roti,Biryani,"Whitefield, Bangalore",150,,0
Andhra Aromas,"Biryani, Andhra, Mughlai","Whitefield, Bangalore",250,,3
VV Rolls And Shawarma,"Rolls, Lebanese","Whitefield, Bangalore",200,,3
Delhi Darbar Restaurant,"North Indian, Chinese, Biryani","Whitefield, Bangalore",150,,0
One Plate Club Restaurant,"Biryani, Mughlai","KR Puram, Bangalore",400,3.9,4
Garhwali Khana,North Indian,"Whitefield, Bangalore",100,,3
Cafe Palmyra,"Chinese, North Indian, Continental, Cafe","Palm Meadows Club, Whitefield, Bangalore",2000,4.2,1
Covai Cafe,"South Indian, Chinese, North Indian","Whitefield, Bangalore",350,3.4,0
Herbs & Spices,"Italian, North Indian, Desserts, Mangalorean","Whitefield, Bangalore",1200,4.2,1
Ammu Home Foods,South Indian,"Whitefield, Bangalore",100,,3
The Daily Meal,"Mughlai, North Indian","Whitefield, Bangalore",250,,0
NYSF Burgers,Burger,"Whitefield, Bangalore",350,,0
Highway On The Plate,"North Indian, Rolls","Whitefield, Bangalore",200,,0
Whitefield Dum Biriyani,"Biryani, Mughlai","Whitefield, Bangalore",400,,0
The Mamak,"Asian, Fast Food","Whitefield, Bangalore",150,,3
The Daily Bowl,"North Indian, Desserts","Whitefield, Bangalore",300,,0
Shahenshah Biryani,"Biryani, Desserts","Whitefield, Bangalore",350,,3
Mealicious,"North Indian, Chinese, Street Food, Beverages","Whitefield, Bangalore",200,,3
Burger King,"Burger, Fast Food, Beverages, Desserts","Koramangala 7th Block, Bangalore",400,4.0,4
McDonald's,"Burger, Beverages, Fast Food, Desserts","Koramangala 5th Block, Bangalore",400,3.6,0
WOW! Momo,"Momos, Fast Food, Tibetan","Koramangala 5th Block, Bangalore",400,2.9,2
Empire Restaurant,"North Indian, Biryani, Kebab, Chinese, South Indian, Beverages","Koramangala 5th Block, Bangalore",700,4.1,4
Leon Grill,"Burger, Fast Food, Wraps, Street Food, Desserts, Beverages","Koramangala 5th Block, Bangalore",400,4.2,4
Mani's Dum Biryani,"Biryani, Kebab","Koramangala 5th Block, Bangalore",800,4.1,4
Sardarji Londonwaley,"North Indian, Chinese","Koramangala 7th Block, Bangalore",500,3.9,4
Five Star New Ambur Biryani,"Biryani, Fast Food, South Indian","BTM, Bangalore",350,3.1,2
Calicut Cafe Restaurant,"Kerala, South Indian, Biryani, Chinese, Juices, Beverages, Shake","BTM, Bangalore",400,3.0,2
Chicking,"Burger, Fast Food","HSR, Bangalore",200,,0
Punjabi Nawabi,"North Indian, Biryani, Mughlai, Chinese","Koramangala 7th Block, Bangalore",150,,3
Amma's Pastries,Bakery,"Jayanagar, Bangalore",100,,3
Madeena Hotel,"South Indian, Chinese, North Indian","Koramangala 5th Block, Bangalore",400,4.0,4
Kannur Food Kitchen,"South Indian, Biryani, Chinese, Shake","BTM, Bangalore",500,3.1,2
99 Variety Dosa & Pav Bhaji,"South Indian, Street Food","Koramangala 6th Block, Bangalore",250,3.8,0
Namaste,"South Indian, Beverages, Chinese","BTM, Bangalore",100,4.1,0
Chai Days,"Fast Food, Beverages","Koramangala 5th Block, Bangalore",300,3.5,0
Onesta,"Pizza, Pasta, Fast Food, Desserts, Beverages, Sandwich, North Indian","Koramangala 5th Block, Bangalore",500,4.4,4
A2B - Adyar Ananda Bhavan,"South Indian, Fast Food, Street Food, Ice Cream, Beverages, North Indian, Chinese","Koramangala 7th Block, Bangalore",800,2.3,2
FreshMenu,"Continental, North Indian, Biryani","Koramangala 1st Block, Bangalore",200,,3
Beijing Bites,"Chinese, Thai, Seafood, Healthy Food","Koramangala 5th Block, Bangalore",800,4.1,4
BOX8 - Desi Meals,"North Indian, Wraps, Fast Food, Biryani, Desserts, Beverages","Koramangala 6th Block, Bangalore",200,,0
Kullad Cafe,"North Indian, Fast Food, Beverages, Shake","BTM, Bangalore",300,3.8,0
OOttupura ,"Kerala, South Indian","BTM, Bangalore",300,3.6,0
Pizza Hut,"Pizza, Fast Food, Desserts, Beverages","Koramangala 6th Block, Bangalore",400,4.0,4
Meghana Foods,"Biryani, Andhra, North Indian, Seafood","Koramangala 5th Block, Bangalore",700,4.3,4
Kabab Magic,"North Indian, Kebab, Hyderabadi, Beverages","BTM, Bangalore",400,3.8,4
Five Star Chicken,Fast Food,"Koramangala 5th Block, Bangalore",100,,0
Kanti Sweets,"Mithai, Street Food, Desserts","Koramangala 3rd Block, Bangalore",50,,0
Al-Bek,"North Indian, Mughlai, Andhra, Chinese","Koramangala 7th Block, Bangalore",100,,3
Polar Bear,"Ice Cream, Beverages, Shake","Koramangala 6th Block, Bangalore",350,4.1,4
Ovenstory Pizza,"Pizza, Desserts","Koramangala 1st Block, Bangalore",250,,3
Corner House Ice Creams,"Desserts, Ice Cream, Beverages","Koramangala 7th Block, Bangalore",300,4.7,4
Hari Super Sandwich,"Fast Food, Sandwich, Street Food","Jayanagar, Bangalore",200,4.0,0
MOJO Pizza - 2X Toppings,"Pizza, Fast Food, Desserts, Beverages","Koramangala 6th Block, Bangalore",250,,0
Goli Vadapav No 1,"Street Food, Fast Food, Burger, Ice Cream, Desserts","Koramangala 4th Block, Bangalore",100,,0
Anand Sweets And Savouries,"Mithai, Street Food, Desserts, Beverages","Koramangala 5th Block, Bangalore",300,4.4,4
Nandhana Palace,"Biryani, Andhra, North Indian, Chinese, Mughlai, South Indian, Desserts, Beverages","Koramangala 4th Block, Bangalore",800,4.2,4
La Pino'z Pizza,"Pizza, Fast Food, Beverages","Koramangala 4th Block, Bangalore",450,4.2,4
CakeZone,"Bakery, Desserts","Koramangala 4th Block, Bangalore",300,,0
Taco Bell,"Mexican, Fast Food, Wraps, Beverages","Koramangala 6th Block, Bangalore",600,4.0,4
Lassi Shop,"Beverages, Ice Cream, Desserts, Shake","Koramangala 1st Block, Bangalore",100,,0
Thalassery Restaurant,"Kerala, North Indian, Chinese, Seafood, Beverages, Shake","Bannerghatta Road, Bangalore",700,3.1,2
Samosa Party,"Fast Food, Beverages, Burger, Tea","Koramangala 5th Block, Bangalore",200,4.0,0
Subway,"Healthy Food, Fast Food, Sandwich, Salad, Beverages, Wraps","Koramangala 5th Block, Bangalore",400,3.6,0
Kwality Wall’s Frozen Dessert and Ice Cream Shop,Ice Cream,"Koramangala 5th Block, Bangalore",100,,3
Biryani Trip,Biryani,"Koramangala 6th Block, Bangalore",250,,3
NIC - Natural Ice Creams,Ice Cream,"Koramangala 8th Block, Bangalore",100,,3
Donne Biryani House,"Biryani, Fast Food","BTM, Bangalore",250,,3
Sri Udupi Food Hub,"South Indian, North Indian, Chinese, Sandwich, Desserts, Shake, Beverages","Jayanagar, Bangalore",300,2.9,2
Natural Ice Cream,"Ice Cream, Beverages","Koramangala 1st Block, Bangalore",300,4.8,4
Shree Mahalakshmi Sweets,"Mithai, Street Food","HSR, Bangalore",300,3.5,0
Dindigul Thalappakatti,"Biryani, North Indian, South Indian, Chinese, Beverages","Forum Mall, Koramangala, Bangalore",400,,0
Ludos Pizza,Pizza,"Koramangala 5th Block, Bangalore",200,,3
Faasos - Wraps & Rolls,"North Indian, Desserts, Wraps, Beverages","Koramangala 1st Block, Bangalore",200,,3
EatFit,"Mithai, North Indian, Pizza, Burger, Fast Food, Street Food, Desserts, Beverages","Koramangala 7th Block, Bangalore",400,3.8,4
WarmOven Cake & Desserts,"Bakery, Desserts","Koramangala 6th Block, Bangalore",350,,0
Falahaar & Kota Kachori,"North Indian, Rajasthani, Fast Food, Mithai, Beverages","Koramangala 7th Block, Bangalore",400,4.4,4
Chaatimes,"Street Food, Fast Food","BTM, Bangalore",200,3.3,2
Cakewala,"Bakery, Desserts","Jayanagar, Bangalore",100,,0
Yumlane Pizza,"Pizza, Fast Food, Desserts, Beverages","Koramangala 4th Block, Bangalore",250,,3
Glen's Bakehouse,"Bakery, Italian, Pizza, Sandwich, Street Food, Desserts, Beverages","Koramangala 6th Block, Bangalore",400,3.7,0
Meat And Eat,"Burger, Fast Food, Desserts, Beverages, BBQ, Sandwich, Finger Food","BTM, Bangalore",400,3.2,2
Chai Point,"Tea, North Indian, Fast Food, Street Food, Beverages","Koramangala 5th Block, Bangalore",400,3.0,2
Sharief Bhai,"Mughlai, Arabian, Afghan, Biryani, Kebab, Street Food, Beverages","Koramangala 5th Block, Bangalore",800,4.4,4
Krispy Kreme,"Desserts, Beverages","Forum Mall, Koramangala, Bangalore",400,4.2,4
Laddoos,"Mithai, North Indian, Beverages, Fast Food, Street Food, Desserts","BTM, Bangalore",300,3.2,2
Imperial Restaurant,"Mughlai, North Indian, Biryani, Chinese, Seafood, Ice Cream, Desserts, Beverages","Koramangala 6th Block, Bangalore",700,3.2,2
Bakingo,"Bakery, Desserts","Koramangala 1st Block, Bangalore",350,,0
Snack House,"Street Food, Momos","BTM, Bangalore",150,,3
Sandwich Guru,"Fast Food, Sandwich, Beverages, Ice Cream, Shake","Jayanagar, Bangalore",100,,0
Savoury Restaurant,"Arabian, North Indian, Chinese, Fast Food, Shake","BTM, Bangalore",800,3.8,4
Chaayos Chai+Snacks=Relax,Beverages,"Koramangala 7th Block, Bangalore",200,,3
Behrouz Biryani,"Biryani, Mughlai","Koramangala 1st Block, Bangalore",350,,3
The Belgian Waffle Co.,"Desserts, Ice Cream, Waffle","BTM, Bangalore",300,,0
Mad Over Donuts,"Desserts, Beverages","Koramangala 5th Block, Bangalore",100,,3
Sri Udupi Park,"South Indian, Chinese, Street Food, Beverages, North Indian, Shake","Residency Road, Bangalore",200,3.7,0
Wendy's,"Burger, Fast Food","Bommanahalli, Bangalore",200,,3
Eat At Kannur,"South Indian, Chinese, North Indian, Biryani, Fast Food, Street Food, Desserts, Beverages","BTM, Bangalore",400,3.1,2
Baskin Robbins,"Ice Cream, Desserts, Beverages","Koramangala 3rd Block, Bangalore",400,3.8,4
Hari Super Sandwich,"Fast Food, Sandwich, Street Food","Jayanagar, Bangalore",200,4.6,4
New Udupi Grand,"South Indian, North Indian, Street Food, Beverages, Chinese, Shake","Koramangala 8th Block, Bangalore",600,3.0,2
Donne Biriyani House,"Biryani, North Indian","HSR, Bangalore",400,3.5,0
Asha Tiffins,"South Indian, North Indian, Chinese, Beverages","HSR, Bangalore",200,4.4,4
Cake N Chef,"Bakery, Desserts","Bannerghatta Road, Bangalore",350,,0
California Burrito,"Mexican, Fast Food, Beverages, Desserts","Koramangala 5th Block, Bangalore",500,4.2,4
Vijayalakshmi Veg,"South Indian, Chinese, North Indian","Jayanagar, Bangalore",300,3.7,0
Theobroma,"Desserts, Bakery, Beverages, Fast Food, Sandwich","Koramangala 5th Block, Bangalore",400,3.0,2
Paakashala,"South Indian, North Indian, Chinese, Beverages, Juices, Desserts, Street Food","Jayanagar, Bangalore",100,,3
Rolls On Wheels,"Rolls, Chinese, North Indian","Jayanagar, Bangalore",300,3.0,2
Ice Corner,"Desserts, Ice Cream, Beverages, Shake","Koramangala 5th Block, Bangalore",100,,0
Smoor,"Desserts, Cafe, Pizza, Asian, Thai, Italian, Beverages, Shake","Koramangala 7th Block, Bangalore",900,4.1,4
Shanmukha,"Biryani, Andhra, North Indian, Chinese, Seafood","JP Nagar, Bangalore",650,4.4,4
Zomoz - The Momo Company,"Momos, Fast Food","Bommanahalli, Bangalore",200,,3
Starbucks Coffee,"Coffee, Desserts, Beverages","Koramangala 7th Block, Bangalore",600,4.2,4
Potful - Claypot Biryanis,"Biryani, Kebab, Mughlai, North Indian, Desserts, Beverages","Koramangala 1st Block, Bangalore",300,,0
Paratha Envy,North Indian,"Koramangala 5th Block, Bangalore",400,3.4,2
Chaat Street,"Street Food, Fast Food, North Indian, Beverages","Koramangala 4th Block, Bangalore",100,,3
Kapoor's Cafe,"North Indian, Beverages, Desserts","Jayanagar, Bangalore",700,3.9,4
Barbeque Nation,"BBQ, Mughlai, Biryani, North Indian, Desserts, Beverages","Koramangala 1st Block, Bangalore",1600,4.6,1
Udupi Palace,"South Indian, North Indian, Street Food, Fast Food, Chinese, Shake","HSR, Bangalore",400,3.7,0
Karnataka Bhel House,"Street Food, Ice Cream","Jayanagar, Bangalore",100,,0
Kaati Zone Rolls And Wraps,"Rolls, Sandwich","Koramangala 6th Block, Bangalore",150,,0
Keventers - Milkshakes & Desserts,"Ice Cream, Desserts, Shake, Beverages","Koramangala 7th Block, Bangalore",250,,0
Anjappar,"Chettinad, Biryani, Chinese, Seafood, South Indian, Mughlai, North Indian, Desserts","Koramangala 4th Block, Bangalore",800,4.1,4
Just Shawarma,"Lebanese, Fast Food, Beverages","Koramangala 5th Block, Bangalore",100,,0
ZAZA 22 Spice Biryani,"Biryani, North Indian, Mughlai, Desserts","Koramangala 6th Block, Bangalore",200,,0
Cupcake Bliss Cakes & Desserts,"Bakery, Desserts","Koramangala 6th Block, Bangalore",300,,3
Biryani Pot,"Biryani, North Indian, Chinese, Hyderabadi, Andhra, Wraps","BTM, Bangalore",500,4.0,4
EasyBites by Empire,"Burger, Fast Food, Beverages","Koramangala 5th Block, Bangalore",100,,0
ibaco,Desserts,"Koramangala 4th Block, Bangalore",250,4.2,4
Roti Wala,"North Indian, Fast Food, Healthy Food, Desserts, Beverages, Chinese","BTM, Bangalore",300,4.1,4
Kedia's Fun Food,"North Indian, Street Food, Beverages","Jayanagar, Bangalore",50,,0
Ande Ka Funda,"North Indian, Rolls, Chinese","BTM, Bangalore",200,3.1,2
Kolkata Famous Kati Rolls,Rolls,"Jayanagar, Bangalore",200,2.8,2
Empire Juices And Ice Creams,"Shake, Ice Cream, Desserts, Beverages","Koramangala 5th Block, Bangalore",100,,3
Bhartiya Jalpan,"North Indian, Street Food, Mithai, Rajasthani, Bengali, Beverages","HSR, Bangalore",300,2.5,2
Hyderabadi Biryani Hub,"Biryani, North Indian, Chinese, Andhra, Hyderabadi","BTM, Bangalore",800,3.9,4
Great Indian Khichdi,"Healthy Food, North Indian","Koramangala 5th Block, Bangalore",150,,3
Meghduth Biryanis,"Biryani, Andhra, Hyderabadi, South Indian","Jayanagar, Bangalore",350,,3
Momoz,"Chinese, Momos, Seafood, Thai","BTM, Bangalore",500,4.1,4
Texas Burgers,"Burger, Fast Food, Beverages","BTM, Bangalore",150,,3
Sangam Sweets,"Mithai, Street Food, Fast Food, Beverages","HSR, Bangalore",300,3.9,4
The Dessert Zone,"Desserts, Bakery","Koramangala 6th Block, Bangalore",200,,3
"Frozen Bottle - Milkshakes, Desserts and Ice Cream","Beverages, Desserts, Ice Cream, Waffle, Bakery, Healthy Food","Koramangala 5th Block, Bangalore",200,,0
New Shanthi Sagar,"South Indian, North Indian, Chinese, Street Food, Beverages, Shake","Basavanagudi, Bangalore",600,2.6,2
Juice Junction,"Juices, Sandwich, Beverages, Shake","BTM, Bangalore",50,,0
LunchBox - Meals and Thalis,"North Indian, Healthy Food, Beverages, Chinese","Koramangala 1st Block, Bangalore",200,,3
Davanagere Benne Dose,"South Indian, Kerala","Jayanagar, Bangalore",50,,0
The Pizza Bakery - Brew & Eatery,"Pizza, Pasta, Italian, Continental, Fast Food, Salad, Desserts, Beverages","Church Street, Bangalore",500,4.0,4
Ambur Hot Dum Biryani,Biryani,"BTM, Bangalore",250,3.4,0
Momo Monk,Momos,"Koramangala 6th Block, Bangalore",150,,3
Momo Zone - The Momo Company,"Momos, Fast Food","Koramangala 6th Block, Bangalore",150,,3
Chicken County Restaurant,"North Indian, Chinese, Mughlai, Seafood, Fast Food, Biryani, Beverages","Bannerghatta Road, Bangalore",600,4.0,4
Chef Bakers,"Bakery, Fast Food, Pizza, Sandwich, Burger, Desserts","Bellandur, Bangalore",400,3.1,2
Chinese Wok - Wok Express,"Momos, Chinese","Koramangala 7th Block, Bangalore",200,,3
Aubree,"Fast Food, Italian, Thai","Koramangala 6th Block, Bangalore",900,3.5,4
The Biryani Life,"Fast Food, North Indian, Desserts, Beverages","Koramangala 1st Block, Bangalore",250,,3
Five Star Chicken And Kolihut,Fast Food,"Bommanahalli, Bangalore",350,3.5,0
Ambur Star Briyani Since 1890,"Biryani, Chettinad, Chinese","Koramangala 5th Block, Bangalore",450,3.5,3
Just Bake,"Bakery, Desserts, Fast Food","Frazer Town, Bangalore",350,3.4,0
Bake and Juice,"Arabian, Sandwich, Burger, Biryani, Lebanese, Beverages, Juices, Shake","Hosur Road, Bangalore",400,2.9,2
Donne Biryani Palace,"Biryani, South Indian","BTM, Bangalore",300,3.6,0
Big Bowl Company,"North Indian, Chinese, Biryani, Fast Food, Momos","Koramangala 7th Block, Bangalore",200,,3
Aligarh House,"Biryani, North Indian, Kebab, Desserts, Beverages","Koramangala 7th Block, Bangalore",250,,3
Cafe Coffee Day,"Coffee, Fast Food, Desserts, Beverages","Koramangala 5th Block, Bangalore",600,2.6,2
By 2 Coffee,South Indian,"Basavanagudi, Bangalore",150,3.8,0
Adiga's,"South Indian, North Indian, Chinese, Street Food, Desserts, Ice Cream, Beverages","HSR, Bangalore",800,3.8,4
Ghee And Turmeric,North Indian,"Koramangala 4th Block, Bangalore",350,,3
Kalingas,"North Indian, Odia, South Indian","BTM, Bangalore",300,4.0,4
WOW! China,"Chinese, Rolls, Desserts, Shake","HSR, Bangalore",200,,0
Madurai Idly Shop,"South Indian, Chinese","Koramangala 7th Block, Bangalore",300,3.7,0
99 Varieties Dosa And Pav Bhaji,South Indian,"BTM, Bangalore",100,,3
Sweet Truth - Cake and Desserts,Bakery,"Koramangala 1st Block, Bangalore",250,,3
Biryani Blues,"Biryani, Kebab, Hyderabadi","Bommanahalli, Bangalore",250,,3
Friendly Neighbourhood Pizza Man,"Pizza, Fast Food, Desserts, Beverages","Basavanagudi, Bangalore",400,3.7,0
Hyderabad Magic,"Arabian, Fast Food","HSR, Bangalore",400,3.5,0
Hotel Salam,"Lebanese, Kebab, Rolls, South Indian","Bommanahalli, Bangalore",200,4.0,4
Nando's,"Fast Food, Burger, Portuguese","Koramangala 7th Block, Bangalore",500,,3
Rooftop Cafe,"Pizza, Fast Food, Chinese, Coffee, Beverages","Jayanagar, Bangalore",350,4.1,4
Thalaivars Biryani,"Biryani, South Indian","HSR, Bangalore",250,,3
XO Belgian Waffle,"Desserts, Beverages, Waffle, Shake","Koramangala 5th Block, Bangalore",400,4.4,4
Apsara Ice Creams,"Ice Cream, Desserts","Koramangala 5th Block, Bangalore",400,4.2,4
Dum Biryani Adda,Biryani,"HSR, Bangalore",400,,0
Just Cakes,"Bakery, Desserts","Koramangala 7th Block, Bangalore",100,,0
The Red Box,"Chinese, Thai","HSR, Bangalore",250,,0
Kadavu Shappu Currys,"Kerala, South Indian","HSR, Bangalore",300,3.5,0
Jose Mess,"South Indian, Biryani, Chinese","BTM, Bangalore",300,3.5,0
Sweet Chariot,"Bakery, Desserts","Koramangala 7th Block, Bangalore",150,,0
Toscano,"Italian, Continental, Healthy Food, Salad, Pizza, Desserts, Beverages, Shake","Forum Mall, Koramangala, Bangalore",2400,4.5,1
Khan Saheb Grills & Rolls,"North Indian, Rolls, Kebab, Mughlai, Biryani, Beverages","Koramangala 7th Block, Bangalore",500,4.0,4
Sreeraj Lassi Bar,"Beverages, Shake, Ice Cream, Desserts","Bannerghatta Road, Bangalore",300,3.6,0
Muthashy's,"Kerala, South Indian, Chinese","BTM, Bangalore",400,4.1,4
Fattoush,"North Indian, Mughlai, Chinese, Biryani, Beverages, Shake","Bannerghatta Road, Bangalore",1000,4.2,4
Fanoos Xprss,"Rolls, Fast Food, North Indian","Jayanagar, Bangalore",400,3.2,2
Kundana,"Andhra, Mughlai, North Indian, Chinese, Seafood, Desserts, Beverages","Bannerghatta Road, Bangalore",800,3.9,4
Indiana Burgers,Burger,"Koramangala 6th Block, Bangalore",300,,0
Kunafa World,Desserts,"Koramangala 8th Block, Bangalore",200,,3
Upahara Darshini,"South Indian, North Indian, Fast Food, Street Food, Ice Cream, Beverages, Chinese","Jayanagar, Bangalore",400,3.7,0
The Thickshake Factory,"Beverages, Desserts","Koramangala 5th Block, Bangalore",250,,3
Kailash Parbat,"North Indian, Street Food, Beverages","Vega City, Bannerghatta Road, Bangalore",500,2.9,2
Tenzin Kitchen,"Tibetan, Chinese, Momos","Koramangala 7th Block, Bangalore",600,4.2,4
Cream Stone,"Ice Cream, Desserts, Beverages, Shake","HSR, Bangalore",300,4.3,4
Itminaan Biryani - Dum Pukht,"Biryani, Mughlai, North Indian","Koramangala 6th Block, Bangalore",250,,3
Nagarjuna Chimney,"Andhra, Biryani, North Indian","Jayanagar, Bangalore",600,4.1,4
Sri Vishnu Park,"South Indian, North Indian, Chinese, Biryani, Beverages","BTM, Bangalore",700,3.9,4
Kwality Walls Frozen Dessert and Ice Cream Shop,Ice Cream,"HSR, Bangalore",100,,3
Daily Sushi,"Japanese, Korean, Sushi, Asian","HSR, Bangalore",800,4.2,4
Sri Venkateshwara Sweet Meat Stall,"Mithai, Street Food, Desserts, Beverages","Jayanagar, Bangalore",300,4.0,4
Gopizza,"Pizza, Fast Food","Koramangala 5th Block, Bangalore",500,3.7,4
Third Wave Coffee,"Coffee, Cafe, Beverages, Fast Food","Koramangala 4th Block, Bangalore",400,4.6,4
The Good Bowl,"North Indian, Mughlai","Koramangala 1st Block, Bangalore",200,,0
Iyengars Bakery,"Bakery, Desserts, Fast Food","Lavelle Road, Bangalore",50,,0
Royal Biryani Kitchen,"Biryani, North Indian, Mughlai, Fast Food, Beverages","BTM, Bangalore",150,,0
Auntie Fung's,"Asian, Chinese, Thai, Vietnamese, Japanese, Indonesian, Burmese, Korean","Bommanahalli, Bangalore",300,,0
New Mahesh Friends Food Corner,"North Indian, Chinese, Street Food","BTM, Bangalore",300,3.5,0
TrueCakes,"Bakery, Desserts","BTM, Bangalore",150,,3
Shree Muthahalli Veg,"South Indian, North Indian, Street Food, Desserts, Chinese, Beverages, Shake","HSR, Bangalore",300,4.1,4
Simplee Shawarma,"Lebanese, Fast Food","BTM, Bangalore",200,,0
Le Arabia,"Arabian, North Indian, Mughlai, Chinese, Biryani, Beverages, Desserts","JP Nagar, Bangalore",1000,4.3,1
SL Vadapav,"Street Food, Fast Food","Jayanagar, Bangalore",50,,0
Mumbai Xpress,"Fast Food, North Indian, Street Food, Beverages, Chinese, Shake","Koramangala 5th Block, Bangalore",350,4.0,4
Rolls Kitchen,"Rolls, Fast Food, Beverages","Langford Town, Bangalore",200,3.3,0
Brik Oven,"Fast Food, Desserts, Beverages","Koramangala 5th Block, Bangalore",1200,3.8,1
Dum Biryani Hub,"Biryani, North Indian, Chinese, Desserts, Beverages","BTM, Bangalore",450,3.7,0
Natraj Chole Bhature,"North Indian, Street Food","Jayanagar, Bangalore",200,3.6,0
UBQ By Barbeque Nation,"North Indian, Kebab, BBQ, Biryani","Koramangala 1st Block, Bangalore",250,,3
Bombay Kulfi,Desserts,"Jayanagar, Bangalore",150,,0
Bansuri Sweets,"Mithai, North Indian, Street Food","BTM, Bangalore",200,3.7,0
Hotel Manu,"Kerala, South Indian, Chinese, North Indian, Biryani, Beverages","HSR, Bangalore",400,3.8,4
Samosa Singh,"Street Food, Fast Food, Tea, North Indian","Bommanahalli, Bangalore",150,,0
LeanCrust Pizza - ThinCrust Experts,"Pizza, Fast Food, Beverages","Koramangala 6th Block, Bangalore",350,,3
SLAY Coffee,"Beverages, Coffee","Koramangala 1st Block, Bangalore",150,,3
Biggies Burger,"Burger, Fast Food, Beverages","HSR, Bangalore",300,4.1,4
Charminar Biryani House,"Biryani, North Indian","BTM, Bangalore",300,3.6,0
Hari Super Sandwich,"Sandwich, Fast Food","BTM, Bangalore",200,3.8,0
IDC Kitchen,"South Indian, Beverages","Koramangala 5th Block, Bangalore",150,4.1,4
The Brooklyn Creamery - Healthy Ice Cream,Ice Cream,"Koramangala 5th Block, Bangalore",200,,0
Twiststick House,"Continental, Burger, Chinese, Rolls, Beverages","Basavanagudi, Bangalore",400,4.0,4
HSR High Street,"North Indian, Mughlai, Chinese, Biryani","HSR, Bangalore",800,4.1,4
NH1 Bowls - Highway To North,North Indian,"Koramangala 6th Block, Bangalore",200,,3
Mainland China,"Chinese, Momos, Thai, Asian, Seafood, Sushi, Beverages","Koramangala 7th Block, Bangalore",500,,3
Jeni's Kitchen,"Biryani, Chinese, North Indian, Andhra, Beverages, Shake","Bommanahalli, Bangalore",400,3.3,2
